record_type,game_pk,game_date,season,ref,venue,batting_team,fielding_team,home_away_batting,home_away_pitching,day_night,batter,batter_id,bat_side,batter_split,pitcher,pitcher_id,pitch_hand,pitcher_split,men_on_base,event,event_type,rbi,is_out,is_scoring,total_outs,description,pitch_type,pitch_call,speed_mph,spin_rate,break_vertical,break_horizontal,launch_speed,launch_angle,total_distance,trajectory,hardness
pitch,778321,2025-04-14,2025,202504,PNC Park,Washington Nationals,Pittsburgh Pirates,away,home,night,Alex Call,669743,R,vs_RHP,Paul Skenes,694973,R,vs_RHB,Empty,Groundout,field_out,0,True,False,1,"Alex Call grounds out, third baseman Ke'Bryan Hayes to first baseman Enmanuel Valdez.",Sinker,"In play, out(s)",98.5,2521.0,-20.4,18.7,59.8,-18.0,8.0,ground_ball,medium
pitch,778321,2025-04-14,2025,202504,PNC Park,Washington Nationals,Pittsburgh Pirates,away,home,night,James Wood,695578,L,vs_RHP,Paul Skenes,694973,R,vs_LHB,Men_On,Hit By Pitch,hit_by_pitch,0,False,False,0,James Wood hit by pitch.,Curveball,Hit By Pitch,86.6,2448.0,-39.8,-6.4,,,,,
pitch,778321,2025-04-14,2025,202504,PNC Park,Washington Nationals,Pittsburgh Pirates,away,home,night,Keibert Ruiz,660688,L,vs_RHP,Paul Skenes,694973,R,vs_LHB,Men_On,Strikeout,strikeout,0,True,False,1,Keibert Ruiz strikes out swinging.,Changeup,Swinging Strike,87.9,1899.0,-29.5,14.8,,,,,
pitch,778321,2025-04-14,2025,202504,PNC Park,Washington Nationals,Pittsburgh Pirates,away,home,night,Nathaniel Lowe,663993,L,vs_RHP,Paul Skenes,694973,R,vs_LHB,Empty,Groundout,field_out,0,True,False,1,"Nathaniel Lowe grounds out, shortstop Isiah Kiner-Falefa to first baseman Enmanuel Valdez.",Changeup,"In play, out(s)",88.5,1848.0,-29.5,16.7,92.6,5.0,113.0,ground_ball,medium
pitch,778321,2025-04-14,2025,202504,PNC Park,Pittsburgh Pirates,Washington Nationals,home,away,night,Oneil Cruz,665833,L,vs_RHP,Brad Lord,695418,R,vs_LHB,Empty,Lineout,field_out,0,True,False,1,Oneil Cruz lines out to shortstop Nasim Nuñez.,Four-Seam Fastball,"In play, out(s)",94.2,2226.0,-22.2,10.1,115.3,5.0,182.0,line_drive,medium
pitch,778321,2025-04-14,2025,202504,PNC Park,Pittsburgh Pirates,Washington Nationals,home,away,night,Bryan Reynolds,668804,L,vs_RHP,Brad Lord,695418,R,vs_LHB,Empty,Lineout,field_out,0,True,False,1,Bryan Reynolds lines out to shortstop Nasim Nuñez.,Four-Seam Fastball,"In play, out(s)",97.1,2305.0,-18.7,14.4,76.3,15.0,182.0,line_drive,medium
pitch,778321,2025-04-14,2025,202504,PNC Park,Pittsburgh Pirates,Washington Nationals,home,away,night,Andrew McCutchen,457705,R,vs_RHP,Brad Lord,695418,R,vs_RHB,Men_On,Single,single,0,False,False,0,Andrew McCutchen singles on a line drive to center fielder Dylan Crews.,Four-Seam Fastball,"In play, no out",96.9,2312.0,-18.5,12.4,98.1,14.0,260.0,line_drive,medium
pitch,778321,2025-04-14,2025,202504,PNC Park,Pittsburgh Pirates,Washington Nationals,home,away,night,Enmanuel Valdez,665839,L,vs_RHP,Brad Lord,695418,R,vs_LHB,RISP,Walk,walk,0,False,False,0,Enmanuel Valdez walks. Andrew McCutchen to 2nd.,Four-Seam Fastball,Ball,97.3,2096.0,-24.7,12.1,,,,,
pitch,778321,2025-04-14,2025,202504,PNC Park,Pittsburgh Pirates,Washington Nationals,home,away,night,Ke'Bryan Hayes,663647,R,vs_RHP,Brad Lord,695418,R,vs_RHB,Empty,Single,single,1,True,True,1,"Ke'Bryan Hayes singles on a line drive to right fielder Alex Call. Andrew McCutchen scores. Ke'Bryan Hayes out at 1st on the throw, right fielder Alex Call to catcher Keibert Ruiz to first baseman Nathaniel Lowe. Enmanuel Valdez to 3rd.",Sinker,"In play, out(s)",95.9,2136.0,-25.2,13.8,101.7,6.0,155.0,line_drive,medium
pitch,778321,2025-04-14,2025,202504,PNC Park,Washington Nationals,Pittsburgh Pirates,away,home,night,Josh Bell,605137,L,vs_RHP,Paul Skenes,694973,R,vs_LHB,Empty,Strikeout,strikeout,0,True,False,1,Josh Bell strikes out swinging.,Four-Seam Fastball,Swinging Strike,98.2,2387.0,-15.5,14.8,,,,,
pitch,778321,2025-04-14,2025,202504,PNC Park,Washington Nationals,Pittsburgh Pirates,away,home,night,Luis García Jr.,671277,L,vs_RHP,Paul Skenes,694973,R,vs_LHB,Empty,Groundout,field_out,0,True,False,1,"Luis García Jr. grounds out, shortstop Isiah Kiner-Falefa to first baseman Enmanuel Valdez.",Four-Seam Fastball,"In play, out(s)",98.4,2312.0,-17.8,11.4,88.7,-20.0,8.0,ground_ball,medium
pitch,778321,2025-04-14,2025,202504,PNC Park,Washington Nationals,Pittsburgh Pirates,away,home,night,Paul DeJong,657557,R,vs_RHP,Paul Skenes,694973,R,vs_RHB,Men_On,Single,single,0,False,False,0,"Paul DeJong singles on a fly ball to right fielder Andrew McCutchen, deflected by center fielder Oneil Cruz.",Four-Seam Fastball,"In play, no out",98.6,2393.0,-17.4,14.0,77.2,44.0,251.0,fly_ball,medium
pitch,778321,2025-04-14,2025,202504,PNC Park,Washington Nationals,Pittsburgh Pirates,away,home,night,Dylan Crews,686611,R,vs_RHP,Paul Skenes,694973,R,vs_RHB,Empty,Groundout,field_out,0,True,False,1,"Dylan Crews grounds out, pitcher Paul Skenes to first baseman Enmanuel Valdez.",Slider,"In play, out(s)",85.9,2434.0,-29.8,0.5,67.5,-45.0,3.0,ground_ball,medium
pitch,778321,2025-04-14,2025,202504,PNC Park,Pittsburgh Pirates,Washington Nationals,home,away,night,Henry Davis,680779,R,vs_RHP,Brad Lord,695418,R,vs_RHB,Men_On,Single,single,0,False,False,0,Henry Davis singles on a fly ball to right fielder Alex Call.,Four-Seam Fastball,"In play, no out",95.2,2222.0,-18.1,10.2,73.0,28.0,231.0,fly_ball,medium
pitch,778321,2025-04-14,2025,202504,PNC Park,Pittsburgh Pirates,Washington Nationals,home,away,night,Tommy Pham,502054,R,vs_RHP,Brad Lord,695418,R,vs_RHB,Empty,Grounded Into DP,grounded_into_double_play,0,True,False,2,"Tommy Pham grounds into a double play, third baseman Paul DeJong to second baseman Luis García Jr. to first baseman Nathaniel Lowe. Henry Davis out at 2nd. Tommy Pham out at 1st.",Sinker,"In play, out(s)",95.4,2152.0,-26.9,17.6,77.7,-24.0,6.0,ground_ball,medium
pitch,778321,2025-04-14,2025,202504,PNC Park,Pittsburgh Pirates,Washington Nationals,home,away,night,Adam Frazier,624428,L,vs_RHP,Brad Lord,695418,R,vs_LHB,Empty,Lineout,field_out,0,True,False,1,Adam Frazier lines out to left fielder James Wood.,Slider,"In play, out(s)",85.3,2513.0,-38.4,-4.4,87.4,20.0,272.0,line_drive,medium
pitch,778321,2025-04-14,2025,202504,PNC Park,Washington Nationals,Pittsburgh Pirates,away,home,night,Nasim Nuñez,683083,L,vs_RHP,Paul Skenes,694973,R,vs_LHB,Empty,Strikeout,strikeout,0,True,False,1,Nasim Nuñez strikes out swinging.,Splitter,Swinging Strike,94.1,1794.0,-29.9,13.8,,,,,
pitch,778321,2025-04-14,2025,202504,PNC Park,Washington Nationals,Pittsburgh Pirates,away,home,night,Alex Call,669743,R,vs_RHP,Paul Skenes,694973,R,vs_RHB,Empty,Groundout,field_out,0,True,False,1,"Alex Call grounds out, third baseman Ke'Bryan Hayes to first baseman Enmanuel Valdez.",Four-Seam Fastball,"In play, out(s)",98.0,2435.0,-16.6,16.4,87.4,-6.0,19.0,ground_ball,medium
pitch,778321,2025-04-14,2025,202504,PNC Park,Washington Nationals,Pittsburgh Pirates,away,home,night,James Wood,695578,L,vs_RHP,Paul Skenes,694973,R,vs_LHB,Empty,Strikeout,strikeout,0,True,False,1,James Wood strikes out swinging.,Four-Seam Fastball,Swinging Strike,98.7,2377.0,-17.8,13.8,,,,,
pitch,778321,2025-04-14,2025,202504,PNC Park,Pittsburgh Pirates,Washington Nationals,home,away,night,Isiah Kiner-Falefa,643396,R,vs_RHP,Brad Lord,695418,R,vs_RHB,Empty,Lineout,field_out,0,True,False,1,Isiah Kiner-Falefa lines out to center fielder Dylan Crews.,Four-Seam Fastball,"In play, out(s)",94.9,2199.0,-19.2,15.1,97.3,22.0,370.0,line_drive,medium
pitch,778321,2025-04-14,2025,202504,PNC Park,Pittsburgh Pirates,Washington Nationals,home,away,night,Oneil Cruz,665833,L,vs_RHP,Brad Lord,695418,R,vs_LHB,RISP,Double,double,0,False,False,0,Oneil Cruz doubles (2) on a sharp line drive to left fielder James Wood.,Four-Seam Fastball,"In play, no out",95.1,2165.0,-20.5,13.3,108.7,19.0,348.0,line_drive,hard
pitch,778321,2025-04-14,2025,202504,PNC Park,Pittsburgh Pirates,Washington Nationals,home,away,night,Bryan Reynolds,668804,L,vs_RHP,Brad Lord,695418,R,vs_LHB,Men_On,Single,single,1,False,True,0,Bryan Reynolds singles on a ground ball to left fielder James Wood. Oneil Cruz scores.,Four-Seam Fastball,"In play, run(s)",95.5,2233.0,-23.6,15.5,91.5,3.0,72.0,ground_ball,medium
pitch,778321,2025-04-14,2025,202504,PNC Park,Pittsburgh Pirates,Washington Nationals,home,away,night,Andrew McCutchen,457705,R,vs_RHP,Brad Lord,695418,R,vs_RHB,Empty,Strikeout Double Play,strikeout_double_play,0,True,False,2,"Andrew McCutchen strikes out swinging and Bryan Reynolds caught stealing 2nd, catcher Keibert Ruiz to second baseman Luis García Jr. to catcher Keibert Ruiz.",Slider,Swinging Strike,85.9,2488.0,-35.2,-2.4,,,,,
pitch,778321,2025-04-14,2025,202504,PNC Park,Washington Nationals,Pittsburgh Pirates,away,home,night,Keibert Ruiz,660688,L,vs_RHP,Paul Skenes,694973,R,vs_LHB,Empty,Flyout,field_out,0,True,False,1,Keibert Ruiz flies out to center fielder Oneil Cruz.,Four-Seam Fastball,"In play, out(s)",97.7,2416.0,-18.1,10.7,83.4,34.0,317.0,fly_ball,medium
pitch,778321,2025-04-14,2025,202504,PNC Park,Washington Nationals,Pittsburgh Pirates,away,home,night,Nathaniel Lowe,663993,L,vs_RHP,Paul Skenes,694973,R,vs_LHB,Empty,Strikeout,strikeout,0,True,False,1,Nathaniel Lowe called out on strikes.,Sweeper,Called Strike,82.4,2353.0,-35.6,-20.2,,,,,
pitch,778321,2025-04-14,2025,202504,PNC Park,Washington Nationals,Pittsburgh Pirates,away,home,night,Josh Bell,605137,L,vs_RHP,Paul Skenes,694973,R,vs_LHB,Empty,Groundout,field_out,0,True,False,1,Josh Bell grounds out to first baseman Enmanuel Valdez.,Splitter,"In play, out(s)",94.2,1631.0,-30.6,14.4,90.9,-25.0,5.0,ground_ball,medium
pitch,778321,2025-04-14,2025,202504,PNC Park,Pittsburgh Pirates,Washington Nationals,home,away,night,Enmanuel Valdez,665839,L,vs_RHP,Brad Lord,695418,R,vs_LHB,Men_On,Walk,walk,0,False,False,0,Enmanuel Valdez walks.,Four-Seam Fastball,Ball,95.7,2175.0,-21.4,11.8,,,,,
pitch,778321,2025-04-14,2025,202504,PNC Park,Pittsburgh Pirates,Washington Nationals,home,away,night,Ke'Bryan Hayes,663647,R,vs_RHP,Brad Lord,695418,R,vs_RHB,Empty,Grounded Into DP,grounded_into_double_play,0,True,False,2,"Ke'Bryan Hayes grounds into a double play, pitcher Brad Lord to second baseman Luis García Jr. to first baseman Nathaniel Lowe. Enmanuel Valdez out at 2nd. Ke'Bryan Hayes out at 1st.",Sinker,"In play, out(s)",95.7,2116.0,-25.3,17.4,52.5,-31.0,5.0,ground_ball,soft
pitch,778321,2025-04-14,2025,202504,PNC Park,Pittsburgh Pirates,Washington Nationals,home,away,night,Henry Davis,680779,R,vs_RHP,Brad Lord,695418,R,vs_RHB,Empty,Lineout,field_out,0,True,False,1,Henry Davis lines out to shortstop Nasim Nuñez.,Slider,"In play, out(s)",85.0,2601.0,-38.3,-2.9,87.0,13.0,180.0,line_drive,medium
pitch,778321,2025-04-14,2025,202504,PNC Park,Washington Nationals,Pittsburgh Pirates,away,home,night,Luis García Jr.,671277,L,vs_RHP,Paul Skenes,694973,R,vs_LHB,Empty,Flyout,field_out,0,True,False,1,Luis García Jr. flies out to center fielder Oneil Cruz.,Sweeper,"In play, out(s)",83.2,2403.0,-30.0,-7.4,89.1,52.0,248.0,fly_ball,medium
pitch,778321,2025-04-14,2025,202504,PNC Park,Washington Nationals,Pittsburgh Pirates,away,home,night,Paul DeJong,657557,R,vs_RHP,Paul Skenes,694973,R,vs_RHB,Empty,Strikeout,strikeout,0,True,False,1,Paul DeJong strikes out swinging.,Slider,Swinging Strike,85.6,2403.0,-30.6,-1.9,,,,,
pitch,778321,2025-04-14,2025,202504,PNC Park,Washington Nationals,Pittsburgh Pirates,away,home,night,Dylan Crews,686611,R,vs_RHP,Paul Skenes,694973,R,vs_RHB,Empty,Groundout,field_out,0,True,False,1,"Dylan Crews grounds out, third baseman Ke'Bryan Hayes to first baseman Enmanuel Valdez.",Splitter,"In play, out(s)",95.0,1801.0,-26.0,13.2,61.1,-63.0,3.0,ground_ball,medium
pitch,778321,2025-04-14,2025,202504,PNC Park,Pittsburgh Pirates,Washington Nationals,home,away,night,Tommy Pham,502054,R,vs_RHP,Brad Lord,695418,R,vs_RHB,Men_On,Walk,walk,0,False,False,0,Tommy Pham walks.,Four-Seam Fastball,Ball,94.7,2350.0,-21.1,13.4,,,,,
pitch,778321,2025-04-14,2025,202504,PNC Park,Pittsburgh Pirates,Washington Nationals,home,away,night,Adam Frazier,624428,L,vs_RHP,Brad Lord,695418,R,vs_LHB,RISP,Single,single,0,False,False,0,Adam Frazier singles on a ground ball to center fielder Dylan Crews. Tommy Pham to 2nd.,Four-Seam Fastball,"In play, no out",94.8,2253.0,-21.0,11.5,96.1,7.0,151.0,ground_ball,medium
pitch,778321,2025-04-14,2025,202504,PNC Park,Pittsburgh Pirates,Washington Nationals,home,away,night,Isiah Kiner-Falefa,643396,R,vs_RHP,Brad Lord,695418,R,vs_RHB,RISP,Sac Bunt,sac_bunt,0,True,False,1,"Isiah Kiner-Falefa out on a sacrifice bunt, pitcher Brad Lord to second baseman Luis García Jr. Tommy Pham to 3rd. Adam Frazier to 2nd.",Four-Seam Fastball,"In play, out(s)",95.1,2182.0,-20.4,10.3,28.3,5.0,25.0,bunt_grounder,soft
pitch,778321,2025-04-14,2025,202504,PNC Park,Pittsburgh Pirates,Washington Nationals,home,away,night,Oneil Cruz,665833,L,vs_LHP,Colin Poche,621363,L,vs_LHB,Loaded,Single,single,0,False,False,0,"Oneil Cruz singles on a fly ball to second baseman Luis García Jr., deflected by right fielder Alex Call.",Slider,"In play, no out",80.6,2372.0,-40.6,1.9,85.6,61.0,181.0,fly_ball,medium
pitch,778321,2025-04-14,2025,202504,PNC Park,Pittsburgh Pirates,Washington Nationals,home,away,night,Bryan Reynolds,668804,R,vs_LHP,Colin Poche,621363,L,vs_RHB,RISP,Sac Fly,sac_fly,1,True,True,1,Bryan Reynolds out on a sacrifice fly to center fielder Dylan Crews. Tommy Pham scores.,Four-Seam Fastball,"In play, run(s)",91.8,1993.0,-13.0,2.8,81.4,28.0,308.0,line_drive,medium
pitch,778321,2025-04-14,2025,202504,PNC Park,Pittsburgh Pirates,Washington Nationals,home,away,night,Andrew McCutchen,457705,R,vs_LHP,Colin Poche,621363,L,vs_RHB,Loaded,Walk,walk,0,False,False,0,Andrew McCutchen walks. Adam Frazier to 3rd. Oneil Cruz to 2nd.,Slider,Ball In Dirt,83.3,2263.0,-29.2,4.7,,,,,
pitch,778321,2025-04-14,2025,202504,PNC Park,Pittsburgh Pirates,Washington Nationals,home,away,night,Enmanuel Valdez,665839,L,vs_LHP,Colin Poche,621363,L,vs_LHB,Empty,Single,single,2,True,True,1,"Enmanuel Valdez singles on a ground ball to right fielder Alex Call. Adam Frazier scores. Oneil Cruz scores. Enmanuel Valdez out at 2nd on the throw, right fielder Alex Call to catcher Keibert Ruiz to shortstop Nasim Nuñez. Andrew McCutchen to 3rd.",Four-Seam Fastball,"In play, run(s)",91.6,2046.0,-14.3,-2.3,95.9,-1.0,41.0,ground_ball,medium
pitch,778321,2025-04-14,2025,202504,PNC Park,Washington Nationals,Pittsburgh Pirates,away,home,night,Nasim Nuñez,683083,L,vs_RHP,Paul Skenes,694973,R,vs_LHB,RISP,Double,double,0,False,False,0,Nasim Nuñez doubles (1) on a line drive to left fielder Tommy Pham.,Four-Seam Fastball,"In play, no out",96.2,2393.0,-17.4,16.8,94.4,20.0,299.0,line_drive,medium
pitch,778321,2025-04-14,2025,202504,PNC Park,Washington Nationals,Pittsburgh Pirates,away,home,night,Alex Call,669743,R,vs_RHP,Paul Skenes,694973,R,vs_RHB,RISP,Field Error,field_error,0,False,False,0,"Pirates challenged (tag play), call on the field was upheld: Alex Call reaches on a fielding error by third baseman Ke'Bryan Hayes. Nasim Nuñez to 3rd.",Sweeper,"In play, no out",84.8,2428.0,-34.9,-11.6,75.7,-19.0,6.0,ground_ball,medium
pitch,778321,2025-04-14,2025,202504,PNC Park,Washington Nationals,Pittsburgh Pirates,away,home,night,James Wood,695578,L,vs_RHP,Paul Skenes,694973,R,vs_LHB,Men_On,Forceout,force_out,1,True,True,2,"James Wood grounds into a force out, shortstop Isiah Kiner-Falefa to second baseman Adam Frazier. Nasim Nuñez scores. Alex Call out at 2nd. James Wood to 1st.",Four-Seam Fastball,"In play, run(s)",99.5,2462.0,-17.6,15.6,95.0,-10.0,17.0,ground_ball,medium
pitch,778321,2025-04-14,2025,202504,PNC Park,Washington Nationals,Pittsburgh Pirates,away,home,night,Keibert Ruiz,660688,L,vs_RHP,Paul Skenes,694973,R,vs_LHB,Men_On,Lineout,field_out,0,True,False,1,Keibert Ruiz lines out to right fielder Andrew McCutchen.,Splitter,"In play, out(s)",95.7,1946.0,-28.1,15.7,96.7,15.0,274.0,line_drive,medium
pitch,778321,2025-04-14,2025,202504,PNC Park,Washington Nationals,Pittsburgh Pirates,away,home,night,Nathaniel Lowe,663993,L,vs_RHP,Paul Skenes,694973,R,vs_LHB,RISP,Single,single,1,False,True,0,"Nathaniel Lowe singles on a line drive to center fielder Oneil Cruz. James Wood scores. Nathaniel Lowe to 2nd. Nathaniel Lowe advances to 2nd, on a fielding error by center fielder Oneil Cruz.",Four-Seam Fastball,"In play, run(s)",97.3,2293.0,-18.1,16.8,105.1,10.0,271.0,line_drive,medium
pitch,778321,2025-04-14,2025,202504,PNC Park,Washington Nationals,Pittsburgh Pirates,away,home,night,Josh Bell,605137,L,vs_RHP,Paul Skenes,694973,R,vs_LHB,Empty,Groundout,field_out,0,True,False,1,"Josh Bell grounds out, second baseman Adam Frazier to first baseman Enmanuel Valdez.",Four-Seam Fastball,"In play, out(s)",99.5,2514.0,-18.8,15.5,87.6,-12.0,13.0,ground_ball,medium
pitch,778321,2025-04-14,2025,202504,PNC Park,Pittsburgh Pirates,Washington Nationals,home,away,night,Ke'Bryan Hayes,663647,R,vs_RHP,Jackson Rutledge,671131,R,vs_RHB,Empty,Flyout,field_out,0,True,False,1,Ke'Bryan Hayes flies out to center fielder Dylan Crews.,Sinker,"In play, out(s)",94.5,2255.0,-21.8,17.2,87.5,36.0,302.0,fly_ball,medium
pitch,778321,2025-04-14,2025,202504,PNC Park,Pittsburgh Pirates,Washington Nationals,home,away,night,Henry Davis,680779,R,vs_RHP,Jackson Rutledge,671131,R,vs_RHB,Empty,Strikeout,strikeout,0,True,False,1,Henry Davis called out on strikes.,Slider,Called Strike,83.7,2098.0,-42.2,-2.3,,,,,
pitch,778321,2025-04-14,2025,202504,PNC Park,Pittsburgh Pirates,Washington Nationals,home,away,night,Tommy Pham,502054,R,vs_RHP,Jackson Rutledge,671131,R,vs_RHB,Empty,Strikeout,strikeout,0,True,False,1,Tommy Pham strikes out swinging.,Slider,Swinging Strike,85.3,1978.0,-37.4,-1.8,,,,,
pitch,778321,2025-04-14,2025,202504,PNC Park,Washington Nationals,Pittsburgh Pirates,away,home,night,Luis García Jr.,671277,L,vs_RHP,Justin Lawrence,664875,R,vs_LHB,Empty,Groundout,field_out,0,True,False,1,Luis García Jr. grounds out to first baseman Enmanuel Valdez.,Sweeper,"In play, out(s)",83.3,2977.0,-35.6,-16.9,82.6,-36.0,5.0,ground_ball,medium
pitch,778321,2025-04-14,2025,202504,PNC Park,Washington Nationals,Pittsburgh Pirates,away,home,night,Paul DeJong,657557,R,vs_RHP,Justin Lawrence,664875,R,vs_RHB,Empty,Lineout,field_out,0,True,False,1,Paul DeJong lines out to left fielder Tommy Pham.,Sweeper,"In play, out(s)",82.2,3010.0,-43.0,-19.6,86.7,23.0,296.0,line_drive,medium
pitch,778321,2025-04-14,2025,202504,PNC Park,Washington Nationals,Pittsburgh Pirates,away,home,night,Dylan Crews,686611,R,vs_RHP,Justin Lawrence,664875,R,vs_RHB,Empty,Strikeout,strikeout,0,True,False,1,Dylan Crews strikes out swinging.,Sweeper,Swinging Strike (Blocked),83.7,3041.0,-39.0,-17.4,,,,,
pitch,778321,2025-04-14,2025,202504,PNC Park,Pittsburgh Pirates,Washington Nationals,home,away,night,Adam Frazier,624428,L,vs_RHP,Jackson Rutledge,671131,R,vs_LHB,Empty,Groundout,field_out,0,True,False,1,"Adam Frazier grounds out, shortstop Nasim Nuñez to first baseman Nathaniel Lowe.",Slider,"In play, out(s)",84.5,2183.0,-36.6,-3.5,75.0,-30.0,7.0,ground_ball,medium
pitch,778321,2025-04-14,2025,202504,PNC Park,Pittsburgh Pirates,Washington Nationals,home,away,night,Isiah Kiner-Falefa,643396,R,vs_RHP,Jackson Rutledge,671131,R,vs_RHB,Empty,Flyout,field_out,0,True,False,1,Isiah Kiner-Falefa flies out to left fielder James Wood.,Slider,"In play, out(s)",84.8,2235.0,-36.6,-2.2,85.7,34.0,323.0,fly_ball,medium
pitch,778321,2025-04-14,2025,202504,PNC Park,Pittsburgh Pirates,Washington Nationals,home,away,night,Oneil Cruz,665833,L,vs_RHP,Jackson Rutledge,671131,R,vs_LHB,Empty,Strikeout,strikeout,0,True,False,1,Oneil Cruz strikes out swinging.,Splitter,Swinging Strike,85.4,1698.0,-36.0,13.9,,,,,
pitch,778321,2025-04-14,2025,202504,PNC Park,Washington Nationals,Pittsburgh Pirates,away,home,night,Nasim Nuñez,683083,R,vs_LHP,Caleb Ferguson,657571,L,vs_RHB,Men_On,Single,single,0,False,False,0,Nasim Nuñez singles on a line drive to right fielder Andrew McCutchen.,Four-Seam Fastball,"In play, no out",94.1,2338.0,-13.7,-6.1,80.1,12.0,159.0,line_drive,medium
pitch,778321,2025-04-14,2025,202504,PNC Park,Washington Nationals,Pittsburgh Pirates,away,home,night,Alex Call,669743,R,vs_LHP,Caleb Ferguson,657571,L,vs_RHB,RISP,Groundout,field_out,0,True,False,1,"Alex Call grounds out, second baseman Adam Frazier to first baseman Enmanuel Valdez. Nasim Nuñez to 2nd.",Four-Seam Fastball,"In play, out(s)",94.2,2428.0,-15.2,-7.0,94.0,-24.0,8.0,ground_ball,medium
pitch,778321,2025-04-14,2025,202504,PNC Park,Washington Nationals,Pittsburgh Pirates,away,home,night,James Wood,695578,L,vs_LHP,Caleb Ferguson,657571,L,vs_LHB,RISP,Groundout,field_out,0,True,False,1,"James Wood grounds out, second baseman Adam Frazier to first baseman Enmanuel Valdez. Nasim Nuñez to 3rd.",Cutter,"In play, out(s)",88.3,2709.0,-35.2,3.4,80.3,-29.0,4.0,ground_ball,medium
pitch,778321,2025-04-14,2025,202504,PNC Park,Washington Nationals,Pittsburgh Pirates,away,home,night,Keibert Ruiz,660688,R,vs_LHP,Caleb Ferguson,657571,L,vs_RHB,Men_On,Single,single,1,False,True,0,Keibert Ruiz singles on a line drive to center fielder Oneil Cruz. Nasim Nuñez scores.,Cutter,"In play, run(s)",90.0,2678.0,-28.9,-0.8,92.7,14.0,257.0,line_drive,medium
pitch,778321,2025-04-14,2025,202504,PNC Park,Washington Nationals,Pittsburgh Pirates,away,home,night,Nathaniel Lowe,663993,L,vs_LHP,Caleb Ferguson,657571,L,vs_LHB,Empty,Flyout,field_out,0,True,False,1,Nathaniel Lowe flies out to right fielder Andrew McCutchen.,Slurve,"In play, out(s)",80.1,3095.0,-56.5,10.6,98.3,42.0,359.0,fly_ball,medium
pitch,778321,2025-04-14,2025,202504,PNC Park,Pittsburgh Pirates,Washington Nationals,home,away,night,Bryan Reynolds,668804,L,vs_RHP,Jackson Rutledge,671131,R,vs_LHB,Men_On,Single,single,0,False,False,0,Bryan Reynolds singles on a line drive to right fielder Alex Call.,Slider,"In play, no out",84.4,1992.0,-37.6,-1.2,82.6,16.0,169.0,line_drive,medium
pitch,778321,2025-04-14,2025,202504,PNC Park,Pittsburgh Pirates,Washington Nationals,home,away,night,Andrew McCutchen,457705,R,vs_RHP,Jackson Rutledge,671131,R,vs_RHB,RISP,Walk,walk,0,False,False,0,Andrew McCutchen walks.,Sinker,Ball,93.3,2299.0,-26.4,19.1,,,,,
pitch,778321,2025-04-14,2025,202504,PNC Park,Pittsburgh Pirates,Washington Nationals,home,away,night,Enmanuel Valdez,665839,L,vs_RHP,Eduardo Salazar,674285,R,vs_LHB,RISP,Double,double,1,False,True,0,Enmanuel Valdez doubles (3) on a ground ball to right fielder Alex Call. Bryan Reynolds scores. Andrew McCutchen to 3rd.,Slider,"In play, run(s)",84.2,1979.0,-36.4,-1.7,91.8,5.0,88.0,ground_ball,medium
pitch,778321,2025-04-14,2025,202504,PNC Park,Pittsburgh Pirates,Washington Nationals,home,away,night,Ke'Bryan Hayes,663647,R,vs_RHP,Eduardo Salazar,674285,R,vs_RHB,Men_On,Single,single,2,False,True,0,Ke'Bryan Hayes singles on a line drive to left fielder James Wood. Andrew McCutchen scores. Enmanuel Valdez scores.,Sinker,"In play, run(s)",93.2,2067.0,-27.6,13.3,106.1,7.0,134.0,line_drive,medium
pitch,778321,2025-04-14,2025,202504,PNC Park,Pittsburgh Pirates,Washington Nationals,home,away,night,Henry Davis,680779,R,vs_RHP,Eduardo Salazar,674285,R,vs_RHB,Men_On,Strikeout,strikeout,0,True,False,1,Henry Davis strikes out swinging.,Slider,Swinging Strike,87.7,2221.0,-31.9,-9.2,,,,,
pitch,778321,2025-04-14,2025,202504,PNC Park,Pittsburgh Pirates,Washington Nationals,home,away,night,Tommy Pham,502054,R,vs_RHP,Eduardo Salazar,674285,R,vs_RHB,Men_On,Single,single,1,False,True,0,Tommy Pham singles on a ground ball to right fielder Alex Call. Ke'Bryan Hayes scores.,Sinker,"In play, run(s)",94.2,2079.0,-24.4,14.4,105.7,-20.0,7.0,ground_ball,medium
pitch,778321,2025-04-14,2025,202504,PNC Park,Pittsburgh Pirates,Washington Nationals,home,away,night,Adam Frazier,624428,L,vs_RHP,Eduardo Salazar,674285,R,vs_LHB,RISP,Single,single,0,False,False,0,Adam Frazier singles on a line drive to left fielder James Wood. Tommy Pham to 2nd.,Sinker,"In play, no out",93.7,2106.0,-26.4,14.8,93.2,13.0,220.0,line_drive,medium
pitch,778321,2025-04-14,2025,202504,PNC Park,Pittsburgh Pirates,Washington Nationals,home,away,night,Isiah Kiner-Falefa,643396,R,vs_RHP,Eduardo Salazar,674285,R,vs_RHB,RISP,Single,single,1,False,True,0,Isiah Kiner-Falefa singles on a ground ball to center fielder Dylan Crews. Tommy Pham scores. Adam Frazier to 2nd.,Sinker,"In play, run(s)",93.6,2066.0,-24.8,15.4,92.8,-9.0,14.0,ground_ball,medium
pitch,778321,2025-04-14,2025,202504,PNC Park,Pittsburgh Pirates,Washington Nationals,home,away,night,Oneil Cruz,665833,L,vs_RHP,Eduardo Salazar,674285,R,vs_LHB,RISP,Strikeout,strikeout,0,True,False,1,Oneil Cruz strikes out on a foul tip.,Slider,Foul Tip,87.0,2000.0,-36.7,-6.8,,,,,
pitch,778321,2025-04-14,2025,202504,PNC Park,Pittsburgh Pirates,Washington Nationals,home,away,night,Bryan Reynolds,668804,L,vs_RHP,Eduardo Salazar,674285,R,vs_LHB,Empty,Groundout,field_out,0,True,False,1,"Bryan Reynolds grounds out, second baseman Luis García Jr. to first baseman Nathaniel Lowe.",Sinker,"In play, out(s)",94.0,2120.0,-25.2,13.7,105.0,-21.0,7.0,ground_ball,medium
pitch,778321,2025-04-14,2025,202504,PNC Park,Washington Nationals,Pittsburgh Pirates,away,home,night,Josh Bell,605137,L,vs_RHP,Dennis Santana,642701,R,vs_LHB,Empty,Flyout,field_out,0,True,False,1,Josh Bell flies out to right fielder Tommy Pham.,Slider,"In play, out(s)",87.8,2544.0,-34.7,-5.8,91.3,34.0,345.0,fly_ball,medium
pitch,778321,2025-04-14,2025,202504,PNC Park,Washington Nationals,Pittsburgh Pirates,away,home,night,Luis García Jr.,671277,L,vs_RHP,Dennis Santana,642701,R,vs_LHB,Empty,Groundout,field_out,0,True,False,1,"Luis García Jr. grounds out, second baseman Adam Frazier to first baseman Enmanuel Valdez.",Slider,"In play, out(s)",86.9,2427.0,-33.7,-5.3,108.1,0.0,55.0,ground_ball,medium
