record_type,game_pk,game_date,season,ref,venue,batting_team,fielding_team,home_away_batting,home_away_pitching,day_night,batter,batter_id,bat_side,batter_split,pitcher,pitcher_id,pitch_hand,pitcher_split,men_on_base,event,event_type,rbi,is_out,is_scoring,total_outs,description,pitch_type,pitch_call,speed_mph,spin_rate,break_vertical,break_horizontal,launch_speed,launch_angle,total_distance,trajectory,hardness
pitch,777285,2025-07-01,2025,202507,Coors Field,Houston Astros,Colorado Rockies,away,home,night,Yainer Diaz,673237,R,vs_RHP,Chase Dollander,801403,R,vs_RHB,RISP,Grounded Into DP,grounded_into_double_play,0,True,False,2,"Yainer Diaz grounds into a double play, shortstop Ryan Ritter to second baseman Thairo Estrada to first baseman Michael Toglia. Cam Smith to 3rd. Victor Caratini out at 2nd. Yainer Diaz out at 1st.",Curveball,"In play, out(s)",79.7,2875.0,-48.5,-10.4,95.9,-9.0,15.0,ground_ball,medium
pitch,777285,2025-07-01,2025,202507,Coors Field,Houston Astros,Colorado Rockies,away,home,night,Christian Walker,572233,R,vs_RHP,Chase Dollander,801403,R,vs_RHB,Men_On,Single,single,1,False,True,0,Christian Walker singles on a ground ball to right fielder Tyler Freeman. Cam Smith scores.,Sinker,"In play, run(s)",98.3,2428.0,-22.2,12.0,96.4,1.0,65.0,ground_ball,medium
pitch,777285,2025-07-01,2025,202507,Coors Field,Houston Astros,Colorado Rockies,away,home,night,Cooper Hummel,669450,L,vs_RHP,Chase Dollander,801403,R,vs_LHB,Empty,Lineout,field_out,0,True,False,1,Cooper Hummel lines out to center fielder Brenton Doyle.,Four-Seam Fastball,"In play, out(s)",97.7,2405.0,-17.4,9.8,91.9,22.0,311.0,line_drive,medium
pitch,777285,2025-07-01,2025,202507,Coors Field,Colorado Rockies,Houston Astros,home,away,night,Kyle Farmer,571657,R,vs_LHP,Colton Gordon,676467,L,vs_RHB,Empty,Strikeout,strikeout,0,True,False,1,Kyle Farmer strikes out swinging.,Changeup,Swinging Strike,82.7,1446.0,-33.7,-7.7,,,,,
pitch,777285,2025-07-01,2025,202507,Coors Field,Colorado Rockies,Houston Astros,home,away,night,Michael Toglia,669911,R,vs_LHP,Colton Gordon,676467,L,vs_RHB,Empty,Pop Out,field_out,0,True,False,1,Michael Toglia pops out to first baseman Christian Walker in foul territory.,Sweeper,"In play, out(s)",80.6,2805.0,-35.6,11.9,79.7,76.0,93.0,popup,medium
pitch,777285,2025-07-01,2025,202507,Coors Field,Colorado Rockies,Houston Astros,home,away,night,Orlando Arcia,606115,R,vs_LHP,Colton Gordon,676467,L,vs_RHB,Men_On,Walk,walk,0,False,False,0,Orlando Arcia walks.,Sinker,Ball,91.1,2058.0,-21.8,-12.5,,,,,
pitch,777285,2025-07-01,2025,202507,Coors Field,Colorado Rockies,Houston Astros,home,away,night,Ryan Ritter,690022,R,vs_LHP,Colton Gordon,676467,L,vs_RHB,RISP,Single,single,0,False,False,0,Ryan Ritter singles on a line drive to left fielder Cooper Hummel. Orlando Arcia to 2nd.,Curveball,"In play, no out",77.5,2677.0,-47.4,8.2,87.5,19.0,237.0,line_drive,medium
pitch,777285,2025-07-01,2025,202507,Coors Field,Colorado Rockies,Houston Astros,home,away,night,Tyler Freeman,671289,R,vs_LHP,Colton Gordon,676467,L,vs_RHB,Empty,Groundout,field_out,0,True,False,1,"Tyler Freeman grounds out, shortstop Mauricio Dubón to first baseman Christian Walker.",Four-Seam Fastball,"In play, out(s)",92.3,2026.0,-21.6,-8.5,93.7,-5.0,25.0,ground_ball,medium
pitch,777285,2025-07-01,2025,202507,Coors Field,Houston Astros,Colorado Rockies,away,home,night,Mauricio Dubón,643289,R,vs_RHP,Chase Dollander,801403,R,vs_RHB,Men_On,Single,single,0,False,False,0,Mauricio Dubón singles on a line drive to right fielder Tyler Freeman.,Sinker,"In play, no out",96.2,2401.0,-25.0,14.2,85.6,15.0,218.0,line_drive,medium
pitch,777285,2025-07-01,2025,202507,Coors Field,Houston Astros,Colorado Rockies,away,home,night,Isaac Paredes,670623,R,vs_RHP,Chase Dollander,801403,R,vs_RHB,RISP,Walk,walk,0,False,False,0,Isaac Paredes walks. Mauricio Dubón to 2nd.,Four-Seam Fastball,Ball,97.4,2351.0,-16.0,7.9,,,,,
pitch,777285,2025-07-01,2025,202507,Coors Field,Houston Astros,Colorado Rockies,away,home,night,Jake Meyers,676694,R,vs_RHP,Chase Dollander,801403,R,vs_RHB,Men_On,Forceout,force_out,1,True,True,2,"Jake Meyers grounds into a force out, shortstop Ryan Ritter to second baseman Thairo Estrada. Mauricio Dubón scores. Isaac Paredes out at 2nd. Jake Meyers to 1st.",Sinker,"In play, run(s)",98.4,2341.0,-25.4,12.4,110.4,-20.0,7.0,ground_ball,medium
pitch,777285,2025-07-01,2025,202507,Coors Field,Houston Astros,Colorado Rockies,away,home,night,Jose Altuve,514888,R,vs_RHP,Chase Dollander,801403,R,vs_RHB,RISP,Walk,walk,0,False,False,0,Jose Altuve walks. Jake Meyers to 2nd.,Four-Seam Fastball,Ball,98.4,2507.0,-18.2,10.0,,,,,
pitch,777285,2025-07-01,2025,202507,Coors Field,Houston Astros,Colorado Rockies,away,home,night,Cam Smith,701358,R,vs_RHP,Chase Dollander,801403,R,vs_RHB,Loaded,Single,single,0,False,False,0,Cam Smith singles on a sharp line drive to right fielder Tyler Freeman. Jake Meyers to 3rd. Jose Altuve to 2nd.,Sinker,"In play, no out",97.3,2557.0,-25.0,13.3,100.7,14.0,281.0,line_drive,hard
pitch,777285,2025-07-01,2025,202507,Coors Field,Houston Astros,Colorado Rockies,away,home,night,Victor Caratini,605170,L,vs_RHP,Chase Dollander,801403,R,vs_LHB,Empty,Home Run,home_run,4,False,True,0,Victor Caratini hits a grand slam (7) to right field. Jake Meyers scores. Jose Altuve scores. Cam Smith scores.,Curveball,"In play, run(s)",79.7,2830.0,-46.1,-15.2,102.6,31.0,413.0,fly_ball,medium
pitch,777285,2025-07-01,2025,202507,Coors Field,Houston Astros,Colorado Rockies,away,home,night,Yainer Diaz,673237,R,vs_RHP,Chase Dollander,801403,R,vs_RHB,Empty,Groundout,field_out,0,True,False,1,"Yainer Diaz grounds out, shortstop Ryan Ritter to first baseman Michael Toglia.",Sinker,"In play, out(s)",98.1,2393.0,-25.8,14.4,106.2,-32.0,6.0,ground_ball,medium
pitch,777285,2025-07-01,2025,202507,Coors Field,Houston Astros,Colorado Rockies,away,home,night,Christian Walker,572233,R,vs_RHP,Chase Dollander,801403,R,vs_RHB,Men_On,Single,single,0,False,False,0,Christian Walker singles on a sharp line drive to center fielder Brenton Doyle.,Sinker,"In play, no out",97.1,2385.0,-28.8,14.9,103.7,11.0,254.0,line_drive,hard
pitch,777285,2025-07-01,2025,202507,Coors Field,Houston Astros,Colorado Rockies,away,home,night,Cooper Hummel,669450,L,vs_RHP,Jimmy Herget,623474,R,vs_LHB,Empty,Strikeout,strikeout,0,True,False,1,Cooper Hummel called out on strikes.,Four-Seam Fastball,Called Strike,92.2,2385.0,-25.0,12.1,,,,,
pitch,777285,2025-07-01,2025,202507,Coors Field,Colorado Rockies,Houston Astros,home,away,night,Hunter Goodman,696100,R,vs_LHP,Colton Gordon,676467,L,vs_RHB,Men_On,Walk,walk,0,False,False,0,Hunter Goodman walks.,Four-Seam Fastball,Ball,90.4,2007.0,-19.4,-8.3,,,,,
pitch,777285,2025-07-01,2025,202507,Coors Field,Colorado Rockies,Houston Astros,home,away,night,Jordan Beck,687597,R,vs_LHP,Colton Gordon,676467,L,vs_RHB,RISP,Single,single,0,False,False,0,Jordan Beck singles on a ground ball to right fielder Cam Smith. Hunter Goodman to 3rd.,Sinker,"In play, no out",92.7,2154.0,-22.0,-13.6,70.6,-0.0,41.0,ground_ball,medium
pitch,777285,2025-07-01,2025,202507,Coors Field,Colorado Rockies,Houston Astros,home,away,night,Thairo Estrada,642731,R,vs_LHP,Colton Gordon,676467,L,vs_RHB,Men_On,Sac Fly,sac_fly,1,True,True,1,Thairo Estrada out on a sacrifice fly to right fielder Cam Smith. Hunter Goodman scores.,Four-Seam Fastball,"In play, run(s)",92.3,2091.0,-15.6,-5.0,95.4,28.0,368.0,fly_ball,medium
pitch,777285,2025-07-01,2025,202507,Coors Field,Colorado Rockies,Houston Astros,home,away,night,Brenton Doyle,686668,R,vs_LHP,Colton Gordon,676467,L,vs_RHB,Men_On,Forceout,force_out,0,True,False,2,"Brenton Doyle grounds into a force out, shortstop Mauricio Dubón to second baseman Jose Altuve. Jordan Beck out at 2nd. Brenton Doyle to 1st.",Changeup,"In play, out(s)",82.7,1877.0,-34.6,-10.4,67.1,-19.0,9.0,ground_ball,medium
pitch,777285,2025-07-01,2025,202507,Coors Field,Colorado Rockies,Houston Astros,home,away,night,Kyle Farmer,571657,R,vs_LHP,Colton Gordon,676467,L,vs_RHB,Empty,Groundout,field_out,0,True,False,1,"Kyle Farmer grounds out, shortstop Mauricio Dubón to first baseman Christian Walker.",Sinker,"In play, out(s)",91.6,2115.0,-22.0,-11.9,95.0,-14.0,8.0,ground_ball,medium
pitch,777285,2025-07-01,2025,202507,Coors Field,Houston Astros,Colorado Rockies,away,home,night,Mauricio Dubón,643289,R,vs_RHP,Jimmy Herget,623474,R,vs_RHB,Empty,Lineout,field_out,0,True,False,1,Mauricio Dubón lines out to third baseman Orlando Arcia.,Slider,"In play, out(s)",85.2,2646.0,-34.6,2.9,93.9,8.0,142.0,line_drive,medium
pitch,777285,2025-07-01,2025,202507,Coors Field,Houston Astros,Colorado Rockies,away,home,night,Isaac Paredes,670623,R,vs_RHP,Jimmy Herget,623474,R,vs_RHB,Empty,Strikeout,strikeout,0,True,False,1,Isaac Paredes strikes out swinging.,Slider,Swinging Strike,87.0,2723.0,-31.8,-0.4,,,,,
pitch,777285,2025-07-01,2025,202507,Coors Field,Houston Astros,Colorado Rockies,away,home,night,Jake Meyers,676694,R,vs_RHP,Jimmy Herget,623474,R,vs_RHB,Empty,Lineout,field_out,0,True,False,1,Jake Meyers lines out to left fielder Jordan Beck.,Sweeper,"In play, out(s)",77.8,3108.0,-46.4,-14.2,77.5,29.0,281.0,line_drive,medium
pitch,777285,2025-07-01,2025,202507,Coors Field,Colorado Rockies,Houston Astros,home,away,night,Michael Toglia,669911,R,vs_LHP,Colton Gordon,676467,L,vs_RHB,Empty,Flyout,field_out,0,True,False,1,Michael Toglia flies out to shortstop Mauricio Dubón.,Four-Seam Fastball,"In play, out(s)",91.1,2046.0,-22.1,-8.5,80.1,54.0,222.0,fly_ball,medium
pitch,777285,2025-07-01,2025,202507,Coors Field,Colorado Rockies,Houston Astros,home,away,night,Orlando Arcia,606115,R,vs_LHP,Colton Gordon,676467,L,vs_RHB,Empty,Strikeout,strikeout,0,True,False,1,Orlando Arcia strikes out on a foul tip.,Sinker,Foul Tip,92.9,2163.0,-18.1,-10.1,,,,,
pitch,777285,2025-07-01,2025,202507,Coors Field,Colorado Rockies,Houston Astros,home,away,night,Ryan Ritter,690022,R,vs_LHP,Colton Gordon,676467,L,vs_RHB,Men_On,Single,single,0,False,False,0,Ryan Ritter singles on a ground ball to third baseman Isaac Paredes.,Sinker,"In play, no out",92.5,2095.0,-22.4,-12.1,96.6,-5.0,16.0,ground_ball,medium
pitch,777285,2025-07-01,2025,202507,Coors Field,Colorado Rockies,Houston Astros,home,away,night,Tyler Freeman,671289,R,vs_LHP,Colton Gordon,676467,L,vs_RHB,RISP,Double,double,1,False,True,0,Tyler Freeman doubles (8) on a line drive to left fielder Cooper Hummel. Ryan Ritter scores.,Sweeper,"In play, run(s)",82.4,2675.0,-34.8,4.6,85.9,11.0,162.0,line_drive,medium
pitch,777285,2025-07-01,2025,202507,Coors Field,Colorado Rockies,Houston Astros,home,away,night,Hunter Goodman,696100,R,vs_LHP,Colton Gordon,676467,L,vs_RHB,Empty,Flyout,field_out,0,True,False,1,Hunter Goodman flies out to center fielder Jake Meyers.,Curveball,"In play, out(s)",76.3,2613.0,-46.4,9.7,98.9,43.0,362.0,fly_ball,medium
pitch,777285,2025-07-01,2025,202507,Coors Field,Houston Astros,Colorado Rockies,away,home,night,Jose Altuve,514888,R,vs_RHP,Jimmy Herget,623474,R,vs_RHB,Empty,Groundout,field_out,0,True,False,1,"Jose Altuve grounds out, third baseman Orlando Arcia to first baseman Michael Toglia.",Slider,"In play, out(s)",86.2,2734.0,-31.1,3.2,63.7,6.0,68.0,ground_ball,medium
pitch,777285,2025-07-01,2025,202507,Coors Field,Houston Astros,Colorado Rockies,away,home,night,Cam Smith,701358,R,vs_RHP,Jimmy Herget,623474,R,vs_RHB,Empty,Strikeout,strikeout,0,True,False,1,Cam Smith strikes out swinging.,Sweeper,Swinging Strike,78.8,3009.0,-42.5,-10.2,,,,,
pitch,777285,2025-07-01,2025,202507,Coors Field,Houston Astros,Colorado Rockies,away,home,night,Victor Caratini,605170,L,vs_RHP,Jimmy Herget,623474,R,vs_LHB,Empty,Strikeout,strikeout,0,True,False,1,Victor Caratini strikes out swinging.,Slider,Swinging Strike,86.0,2820.0,-32.8,1.3,,,,,
pitch,777285,2025-07-01,2025,202507,Coors Field,Colorado Rockies,Houston Astros,home,away,night,Jordan Beck,687597,R,vs_LHP,Colton Gordon,676467,L,vs_RHB,RISP,Double,double,0,False,False,0,Jordan Beck doubles (17) on a sharp line drive to center fielder Jake Meyers.,Sweeper,"In play, no out",80.6,2705.0,-41.2,11.9,103.6,12.0,243.0,line_drive,hard
pitch,777285,2025-07-01,2025,202507,Coors Field,Colorado Rockies,Houston Astros,home,away,night,Thairo Estrada,642731,R,vs_LHP,Colton Gordon,676467,L,vs_RHB,RISP,Groundout,field_out,0,True,False,1,"Thairo Estrada grounds out, third baseman Isaac Paredes to first baseman Christian Walker. Jordan Beck to 3rd.",Sinker,"In play, out(s)",91.0,2119.0,-23.3,-12.8,,,,ground_ball,medium
pitch,777285,2025-07-01,2025,202507,Coors Field,Colorado Rockies,Houston Astros,home,away,night,Brenton Doyle,686668,R,vs_LHP,Colton Gordon,676467,L,vs_RHB,Men_On,Single,single,1,False,True,0,"Rockies challenged (play at 1st), call on the field was overturned: Brenton Doyle singles on a ground ball to pitcher Colton Gordon. Jordan Beck scores.",Four-Seam Fastball,"In play, run(s)",91.5,2139.0,-19.4,-5.2,64.2,-61.0,1.0,ground_ball,medium
pitch,777285,2025-07-01,2025,202507,Coors Field,Colorado Rockies,Houston Astros,home,away,night,Kyle Farmer,571657,R,vs_LHP,Colton Gordon,676467,L,vs_RHB,Men_On,Forceout,force_out,0,True,False,2,"Kyle Farmer flies into a force out, center fielder Jake Meyers to shortstop Mauricio Dubón to second baseman Jose Altuve. Brenton Doyle out at 2nd. Kyle Farmer to 1st.",Changeup,"In play, out(s)",82.9,1688.0,-31.7,-7.6,100.8,32.0,418.0,fly_ball,medium
pitch,777285,2025-07-01,2025,202507,Coors Field,Colorado Rockies,Houston Astros,home,away,night,Michael Toglia,669911,R,vs_LHP,Colton Gordon,676467,L,vs_RHB,RISP,Single,single,0,False,False,0,Michael Toglia singles on a line drive to left fielder Cooper Hummel. Kyle Farmer to 2nd.,Curveball,"In play, no out",76.9,2737.0,-49.7,8.6,81.9,17.0,196.0,line_drive,medium
pitch,777285,2025-07-01,2025,202507,Coors Field,Colorado Rockies,Houston Astros,home,away,night,Orlando Arcia,606115,R,vs_LHP,Steven Okert,595345,L,vs_RHB,Empty,Groundout,field_out,0,True,False,1,"Orlando Arcia grounds out, shortstop Mauricio Dubón to first baseman Christian Walker.",Slider,"In play, out(s)",80.2,2515.0,-40.0,8.5,87.2,0.0,47.0,ground_ball,medium
pitch,777285,2025-07-01,2025,202507,Coors Field,Houston Astros,Colorado Rockies,away,home,night,Yainer Diaz,673237,R,vs_RHP,Angel Chivilli,683409,R,vs_RHB,Empty,Strikeout,strikeout,0,True,False,1,Yainer Diaz strikes out swinging.,Slider,Swinging Strike,90.1,2249.0,-30.8,-3.2,,,,,
pitch,777285,2025-07-01,2025,202507,Coors Field,Houston Astros,Colorado Rockies,away,home,night,Christian Walker,572233,R,vs_RHP,Angel Chivilli,683409,R,vs_RHB,Men_On,Single,single,0,False,False,0,Christian Walker singles on a line drive to left fielder Jordan Beck.,Four-Seam Fastball,"In play, no out",98.7,2335.0,-20.0,12.5,94.7,19.0,279.0,line_drive,medium
pitch,777285,2025-07-01,2025,202507,Coors Field,Houston Astros,Colorado Rockies,away,home,night,Cooper Hummel,669450,L,vs_RHP,Angel Chivilli,683409,R,vs_LHB,RISP,Walk,walk,0,False,False,0,Cooper Hummel walks. Christian Walker to 2nd.,Four-Seam Fastball,Ball,95.7,2301.0,-19.7,11.6,,,,,
pitch,777285,2025-07-01,2025,202507,Coors Field,Houston Astros,Colorado Rockies,away,home,night,Mauricio Dubón,643289,R,vs_RHP,Angel Chivilli,683409,R,vs_RHB,RISP,Forceout,force_out,0,True,False,2,"Mauricio Dubón grounds into a force out, shortstop Ryan Ritter to second baseman Thairo Estrada. Christian Walker to 3rd. Cooper Hummel out at 2nd. Mauricio Dubón to 1st.",Slider,"In play, out(s)",91.4,2253.0,-30.4,0.0,67.4,-15.0,6.0,ground_ball,medium
pitch,777285,2025-07-01,2025,202507,Coors Field,Houston Astros,Colorado Rockies,away,home,night,Isaac Paredes,670623,R,vs_RHP,Angel Chivilli,683409,R,vs_RHB,Empty,Flyout,field_out,0,True,False,1,Isaac Paredes flies out to left fielder Jordan Beck.,Slider,"In play, out(s)",89.1,2223.0,-29.2,-1.6,84.0,49.0,280.0,fly_ball,medium
pitch,777285,2025-07-01,2025,202507,Coors Field,Colorado Rockies,Houston Astros,home,away,night,Ryan Ritter,690022,R,vs_LHP,Bennett Sousa,656986,L,vs_RHB,Empty,Strikeout,strikeout,0,True,False,1,Ryan Ritter strikes out on a foul tip.,Four-Seam Fastball,Foul Tip,96.7,2232.0,-15.4,-4.8,,,,,
pitch,777285,2025-07-01,2025,202507,Coors Field,Colorado Rockies,Houston Astros,home,away,night,Tyler Freeman,671289,R,vs_LHP,Bennett Sousa,656986,L,vs_RHB,Empty,Groundout,field_out,0,True,False,1,"Tyler Freeman grounds out, shortstop Mauricio Dubón to first baseman Christian Walker.",Four-Seam Fastball,"In play, out(s)",95.3,2090.0,-17.5,-3.0,108.5,-13.0,7.0,ground_ball,medium
pitch,777285,2025-07-01,2025,202507,Coors Field,Colorado Rockies,Houston Astros,home,away,night,Hunter Goodman,696100,R,vs_LHP,Bennett Sousa,656986,L,vs_RHB,Empty,Groundout,field_out,0,True,False,1,"Hunter Goodman grounds out, shortstop Mauricio Dubón to first baseman Christian Walker.",Slider,"In play, out(s)",86.6,2457.0,-36.2,1.9,97.1,-8.0,17.0,ground_ball,medium
pitch,777285,2025-07-01,2025,202507,Coors Field,Houston Astros,Colorado Rockies,away,home,night,Jake Meyers,676694,R,vs_RHP,Jake Bird,656234,R,vs_RHB,Empty,Groundout,field_out,0,True,False,1,"Jake Meyers grounds out, shortstop Ryan Ritter to first baseman Michael Toglia.",Sinker,"In play, out(s)",93.5,2193.0,-31.7,10.2,73.0,-10.0,13.0,ground_ball,medium
pitch,777285,2025-07-01,2025,202507,Coors Field,Houston Astros,Colorado Rockies,away,home,night,Jose Altuve,514888,R,vs_RHP,Jake Bird,656234,R,vs_RHB,Empty,Groundout,field_out,0,True,False,1,"Jose Altuve grounds out, shortstop Ryan Ritter to first baseman Michael Toglia.",Curveball,"In play, out(s)",81.2,2932.0,-49.3,-13.9,87.1,-2.0,30.0,ground_ball,medium
pitch,777285,2025-07-01,2025,202507,Coors Field,Houston Astros,Colorado Rockies,away,home,night,Cam Smith,701358,R,vs_RHP,Jake Bird,656234,R,vs_RHB,Empty,Strikeout,strikeout,0,True,False,1,Cam Smith strikes out swinging.,Curveball,Swinging Strike,81.4,2977.0,-48.2,-13.8,,,,,
pitch,777285,2025-07-01,2025,202507,Coors Field,Colorado Rockies,Houston Astros,home,away,night,Jordan Beck,687597,R,vs_LHP,Bryan King,687911,L,vs_RHB,Men_On,Single,single,0,False,False,0,Jordan Beck singles on a line drive to right fielder Cam Smith.,Four-Seam Fastball,"In play, no out",91.8,2214.0,-20.8,-2.5,90.5,12.0,211.0,line_drive,medium
pitch,777285,2025-07-01,2025,202507,Coors Field,Colorado Rockies,Houston Astros,home,away,night,Thairo Estrada,642731,R,vs_LHP,Bryan King,687911,L,vs_RHB,Men_On,Fielders Choice Out,fielders_choice_out,0,True,False,2,"Thairo Estrada reaches on a fielder's choice out, pitcher Bryan King to third baseman Isaac Paredes to shortstop Mauricio Dubón. Jordan Beck out at 3rd.",Changeup,"In play, out(s)",88.0,1716.0,-28.8,-9.8,63.8,-33.0,4.0,ground_ball,medium
pitch,777285,2025-07-01,2025,202507,Coors Field,Colorado Rockies,Houston Astros,home,away,night,Brenton Doyle,686668,R,vs_LHP,Bryan King,687911,L,vs_RHB,Men_On,Strikeout,strikeout,0,True,False,1,Brenton Doyle called out on strikes.,Four-Seam Fastball,Called Strike,92.8,2113.0,-19.8,-6.2,,,,,
pitch,777285,2025-07-01,2025,202507,Coors Field,Colorado Rockies,Houston Astros,home,away,night,Kyle Farmer,571657,R,vs_LHP,Bryan King,687911,L,vs_RHB,Empty,Groundout,field_out,0,True,False,1,"Kyle Farmer grounds out, third baseman Isaac Paredes to first baseman Christian Walker.",Four-Seam Fastball,"In play, out(s)",93.7,2241.0,-19.2,-4.4,70.8,-23.0,5.0,ground_ball,medium
pitch,777285,2025-07-01,2025,202507,Coors Field,Houston Astros,Colorado Rockies,away,home,night,Victor Caratini,605170,L,vs_RHP,Juan Mejia,675848,R,vs_LHB,Empty,Groundout,field_out,0,True,False,1,"Victor Caratini grounds out softly, pitcher Juan Mejia to first baseman Michael Toglia.",Four-Seam Fastball,"In play, out(s)",96.0,2777.0,-19.4,-1.4,58.7,-32.0,6.0,ground_ball,soft
pitch,777285,2025-07-01,2025,202507,Coors Field,Houston Astros,Colorado Rockies,away,home,night,Yainer Diaz,673237,R,vs_RHP,Juan Mejia,675848,R,vs_RHB,Empty,Lineout,field_out,0,True,False,1,Yainer Diaz lines out to center fielder Brenton Doyle.,Sweeper,"In play, out(s)",83.1,2762.0,-40.6,-12.2,96.6,24.0,374.0,line_drive,medium
pitch,777285,2025-07-01,2025,202507,Coors Field,Houston Astros,Colorado Rockies,away,home,night,Christian Walker,572233,R,vs_RHP,Juan Mejia,675848,R,vs_RHB,Men_On,Single,single,0,False,False,0,Christian Walker singles on a ground ball to first baseman Michael Toglia.,Four-Seam Fastball,"In play, no out",96.6,2689.0,-22.2,1.4,106.2,2.0,86.0,ground_ball,medium
pitch,777285,2025-07-01,2025,202507,Coors Field,Houston Astros,Colorado Rockies,away,home,night,Cooper Hummel,669450,L,vs_RHP,Juan Mejia,675848,R,vs_LHB,Empty,Groundout,field_out,0,True,False,1,"Cooper Hummel grounds out, second baseman Thairo Estrada to first baseman Michael Toglia.",Four-Seam Fastball,"In play, out(s)",94.9,2544.0,-18.5,0.1,80.5,-1.0,33.0,ground_ball,medium
pitch,777285,2025-07-01,2025,202507,Coors Field,Colorado Rockies,Houston Astros,home,away,night,Michael Toglia,669911,L,vs_RHP,Bryan Abreu,650556,R,vs_LHB,Empty,Strikeout,strikeout,0,True,False,1,Michael Toglia strikes out swinging.,Slider,Swinging Strike,85.8,2951.0,-45.0,-4.6,,,,,
pitch,777285,2025-07-01,2025,202507,Coors Field,Colorado Rockies,Houston Astros,home,away,night,Ryan McMahon,641857,L,vs_RHP,Bryan Abreu,650556,R,vs_LHB,Empty,Strikeout,strikeout,0,True,False,1,Ryan McMahon strikes out swinging.,Four-Seam Fastball,Swinging Strike,98.2,2388.0,-15.5,6.7,,,,,
pitch,777285,2025-07-01,2025,202507,Coors Field,Colorado Rockies,Houston Astros,home,away,night,Ryan Ritter,690022,R,vs_RHP,Bryan Abreu,650556,R,vs_RHB,Empty,Strikeout,strikeout,0,True,False,1,Ryan Ritter strikes out swinging.,Slider,Swinging Strike,87.1,3102.0,-41.4,-6.4,,,,,
pitch,777285,2025-07-01,2025,202507,Coors Field,Houston Astros,Colorado Rockies,away,home,night,Mauricio Dubón,643289,R,vs_RHP,Victor Vodnik,680767,R,vs_RHB,Men_On,Single,single,0,False,False,0,Mauricio Dubón singles on a ground ball to left fielder Jordan Beck.,Four-Seam Fastball,"In play, no out",99.4,2448.0,-15.1,5.0,101.0,4.0,100.0,ground_ball,medium
pitch,777285,2025-07-01,2025,202507,Coors Field,Houston Astros,Colorado Rockies,away,home,night,Isaac Paredes,670623,R,vs_RHP,Victor Vodnik,680767,R,vs_RHB,RISP,Groundout,field_out,0,True,False,1,"Isaac Paredes grounds out, third baseman Ryan McMahon to first baseman Michael Toglia. Mauricio Dubón to 2nd.",Four-Seam Fastball,"In play, out(s)",99.0,2311.0,-13.6,5.8,94.0,-8.0,14.0,ground_ball,medium
pitch,777285,2025-07-01,2025,202507,Coors Field,Houston Astros,Colorado Rockies,away,home,night,Jake Meyers,676694,R,vs_RHP,Victor Vodnik,680767,R,vs_RHB,RISP,Walk,walk,0,False,False,0,Jake Meyers walks.,Four-Seam Fastball,Ball,98.8,2420.0,-15.7,4.9,,,,,
pitch,777285,2025-07-01,2025,202507,Coors Field,Houston Astros,Colorado Rockies,away,home,night,Jose Altuve,514888,R,vs_RHP,Victor Vodnik,680767,R,vs_RHB,RISP,Strikeout,strikeout,0,True,False,1,Jose Altuve called out on strikes.,Changeup,Called Strike,93.1,1969.0,-28.2,12.8,,,,,
pitch,777285,2025-07-01,2025,202507,Coors Field,Houston Astros,Colorado Rockies,away,home,night,Cam Smith,701358,R,vs_RHP,Victor Vodnik,680767,R,vs_RHB,Empty,Strikeout,strikeout,0,True,False,1,Cam Smith strikes out swinging.,Slider,Swinging Strike,89.7,2530.0,-35.9,-4.7,,,,,
pitch,777285,2025-07-01,2025,202507,Coors Field,Colorado Rockies,Houston Astros,home,away,night,Tyler Freeman,671289,R,vs_LHP,Josh Hader,623352,L,vs_RHB,Empty,Flyout,field_out,0,True,False,1,Tyler Freeman flies out to right fielder Cam Smith.,Sinker,"In play, out(s)",94.9,2381.0,-15.8,-5.8,87.7,56.0,255.0,fly_ball,medium
pitch,777285,2025-07-01,2025,202507,Coors Field,Colorado Rockies,Houston Astros,home,away,night,Hunter Goodman,696100,R,vs_LHP,Josh Hader,623352,L,vs_RHB,Empty,Home Run,home_run,1,False,True,0,Hunter Goodman homers (16) on a fly ball to left center field.,Sinker,"In play, run(s)",95.3,2249.0,-14.6,-6.5,106.8,31.0,443.0,fly_ball,medium
pitch,777285,2025-07-01,2025,202507,Coors Field,Colorado Rockies,Houston Astros,home,away,night,Jordan Beck,687597,R,vs_LHP,Josh Hader,623352,L,vs_RHB,Men_On,Single,single,0,False,False,0,Jordan Beck singles on a ground ball to left fielder Taylor Trammell.,Slider,"In play, no out",83.0,2623.0,-40.8,4.8,78.3,6.0,86.0,ground_ball,medium
pitch,777285,2025-07-01,2025,202507,Coors Field,Colorado Rockies,Houston Astros,home,away,night,Thairo Estrada,642731,R,vs_LHP,Josh Hader,623352,L,vs_RHB,Men_On,Strikeout,strikeout,0,True,False,1,Thairo Estrada strikes out swinging.,Slider,Swinging Strike (Blocked),84.8,2531.0,-36.8,1.4,,,,,
pitch,777285,2025-07-01,2025,202507,Coors Field,Colorado Rockies,Houston Astros,home,away,night,Brenton Doyle,686668,R,vs_LHP,Josh Hader,623352,L,vs_RHB,Empty,Strikeout,strikeout,0,True,False,1,Brenton Doyle strikes out swinging.,Slider,Swinging Strike (Blocked),83.2,2698.0,-40.9,3.1,,,,,
pitch,777281,2025-07-01,2025,202507,T-Mobile Park,Kansas City Royals,Seattle Mariners,away,home,night,Jonathan India,663697,R,vs_RHP,Emerson Hancock,676106,R,vs_RHB,RISP,Double,double,0,False,False,0,Jonathan India hits a ground-rule double (17) on a line drive to right-center field.,Four-Seam Fastball,"In play, no out",94.1,2264.0,-20.4,14.9,105.3,19.0,363.0,line_drive,hard
pitch,777281,2025-07-01,2025,202507,T-Mobile Park,Kansas City Royals,Seattle Mariners,away,home,night,Bobby Witt Jr.,677951,R,vs_RHP,Emerson Hancock,676106,R,vs_RHB,RISP,Strikeout,strikeout,0,True,False,1,Bobby Witt Jr. strikes out swinging.,Four-Seam Fastball,Swinging Strike,93.7,2422.0,-16.1,9.6,,,,,
pitch,777281,2025-07-01,2025,202507,T-Mobile Park,Kansas City Royals,Seattle Mariners,away,home,night,Vinnie Pasquantino,686469,L,vs_RHP,Emerson Hancock,676106,R,vs_LHB,RISP,Groundout,field_out,0,True,False,1,"Vinnie Pasquantino grounds out softly, third baseman Ben Williamson to first baseman Luke Raley. Jonathan India to 3rd.",Four-Seam Fastball,"In play, out(s)",93.7,2296.0,-16.7,12.0,37.6,10.0,43.0,ground_ball,soft
