record_type,game_pk,game_date,season,ref,venue,batting_team,fielding_team,home_away_batting,home_away_pitching,day_night,batter,batter_id,bat_side,batter_split,pitcher,pitcher_id,pitch_hand,pitcher_split,men_on_base,event,event_type,rbi,is_out,is_scoring,total_outs,description,pitch_type,pitch_call,speed_mph,spin_rate,break_vertical,break_horizontal,launch_speed,launch_angle,total_distance,trajectory,hardness
pitch,824281,2026-05-05,2026,202605,Comerica Park,Boston Red Sox,Detroit Tigers,away,home,night,Jarren Duran,680776,L,vs_LHP,Framber Valdez,664285,L,vs_LHB,Empty,Groundout,field_out,0,True,False,1,"Jarren Duran grounds out, second baseman Hao-Yu Lee to first baseman Spencer Torkelson.",Curveball,"In play, out(s)",79.1,2872.0,-60.7,10.9,76.8,-4.0,19.0,ground_ball,medium
pitch,824281,2026-05-05,2026,202605,Comerica Park,Boston Red Sox,Detroit Tigers,away,home,night,Willson Contreras,575929,R,vs_LHP,Framber Valdez,664285,L,vs_RHB,Empty,Groundout,field_out,0,True,False,1,"Willson Contreras grounds out, shortstop Kevin McGonigle to first baseman Spencer Torkelson.",Sinker,"In play, out(s)",93.8,2078.0,-24.8,-15.0,103.5,-23.0,7.0,ground_ball,medium
pitch,824281,2026-05-05,2026,202605,Comerica Park,Boston Red Sox,Detroit Tigers,away,home,night,Wilyer Abreu,677800,L,vs_LHP,Framber Valdez,664285,L,vs_LHB,Men_On,Single,single,0,False,False,0,Wilyer Abreu singles on a ground ball to left fielder Riley Greene.,Sinker,"In play, no out",96.1,2102.0,-23.0,-15.4,98.2,-19.0,6.0,ground_ball,medium
pitch,824281,2026-05-05,2026,202605,Comerica Park,Boston Red Sox,Detroit Tigers,away,home,night,Trevor Story,596115,R,vs_LHP,Framber Valdez,664285,L,vs_RHB,RISP,Field Error,field_error,0,False,False,0,Trevor Story reaches on a fielding error by third baseman Zach McKinstry. Wilyer Abreu to 3rd.,Curveball,"In play, no out",76.3,2741.0,-62.9,13.0,75.1,7.0,80.0,ground_ball,medium
pitch,824281,2026-05-05,2026,202605,Comerica Park,Boston Red Sox,Detroit Tigers,away,home,night,Ceddanne Rafaela,678882,R,vs_LHP,Framber Valdez,664285,L,vs_RHB,Empty,Home Run,home_run,3,False,True,0,Ceddanne Rafaela homers (2) on a fly ball to right center field. Wilyer Abreu scores. Trevor Story scores.,Changeup,"In play, run(s)",91.0,1539.0,-29.4,-15.8,98.0,30.0,362.0,fly_ball,medium
pitch,824281,2026-05-05,2026,202605,Comerica Park,Boston Red Sox,Detroit Tigers,away,home,night,Andruw Monasterio,655316,R,vs_LHP,Framber Valdez,664285,L,vs_RHB,Empty,Lineout,field_out,0,True,False,1,Andruw Monasterio lines out to right fielder Wenceel Pérez.,Sinker,"In play, out(s)",93.7,2001.0,-27.1,-16.7,86.6,24.0,285.0,line_drive,medium
pitch,824281,2026-05-05,2026,202605,Comerica Park,Detroit Tigers,Boston Red Sox,home,away,night,Matt Vierling,663837,R,vs_LHP,Jovani Morán,663558,L,vs_RHB,Empty,Home Run,home_run,1,False,True,0,Matt Vierling homers (2) on a fly ball to left field.,Changeup,"In play, run(s)",82.4,1745.0,-33.0,-13.1,96.7,39.0,365.0,fly_ball,medium
pitch,824281,2026-05-05,2026,202605,Comerica Park,Detroit Tigers,Boston Red Sox,home,away,night,Kevin McGonigle,805808,L,vs_LHP,Jovani Morán,663558,L,vs_LHB,Empty,Strikeout,strikeout,0,True,False,1,Kevin McGonigle strikes out swinging.,Cutter,Swinging Strike,84.3,2485.0,-33.5,7.3,,,,,
pitch,824281,2026-05-05,2026,202605,Comerica Park,Detroit Tigers,Boston Red Sox,home,away,night,Jahmai Jones,663330,R,vs_LHP,Jovani Morán,663558,L,vs_RHB,Men_On,Single,single,0,False,False,0,Jahmai Jones singles on a line drive to left fielder Jarren Duran.,Changeup,"In play, no out",83.4,1656.0,-31.7,-16.3,92.9,16.0,247.0,line_drive,medium
pitch,824281,2026-05-05,2026,202605,Comerica Park,Detroit Tigers,Boston Red Sox,home,away,night,Dillon Dingler,693307,R,vs_LHP,Jovani Morán,663558,L,vs_RHB,Men_On,Strikeout,strikeout,0,True,False,1,Dillon Dingler strikes out swinging.,Changeup,Swinging Strike,82.7,1680.0,-29.6,-11.5,,,,,
pitch,824281,2026-05-05,2026,202605,Comerica Park,Detroit Tigers,Boston Red Sox,home,away,night,Riley Greene,682985,L,vs_LHP,Jovani Morán,663558,L,vs_LHB,RISP,Walk,walk,0,False,False,0,Riley Greene walks. Jahmai Jones to 2nd.,Four-Seam Fastball,Ball,91.2,2230.0,-17.3,-1.6,,,,,
pitch,824281,2026-05-05,2026,202605,Comerica Park,Detroit Tigers,Boston Red Sox,home,away,night,Wenceel Pérez,672761,R,vs_LHP,Jovani Morán,663558,L,vs_RHB,RISP,Single,single,1,False,True,0,Wenceel Pérez singles on a sharp ground ball to center fielder Ceddanne Rafaela. Jahmai Jones scores. Riley Greene to 3rd.,Four-Seam Fastball,"In play, run(s)",91.7,2445.0,-13.3,-3.4,104.1,8.0,146.0,ground_ball,hard
pitch,824281,2026-05-05,2026,202605,Comerica Park,Detroit Tigers,Boston Red Sox,home,away,night,Spencer Torkelson,679529,R,vs_LHP,Jovani Morán,663558,L,vs_RHB,Loaded,Walk,walk,0,False,False,0,Spencer Torkelson walks. Wenceel Pérez to 2nd.,Four-Seam Fastball,Ball,91.0,2299.0,-16.0,-1.1,,,,,
pitch,824281,2026-05-05,2026,202605,Comerica Park,Detroit Tigers,Boston Red Sox,home,away,night,Zach McKinstry,656716,L,vs_LHP,Jovani Morán,663558,L,vs_LHB,Empty,Strikeout,strikeout,0,True,False,1,Zach McKinstry strikes out swinging.,Four-Seam Fastball,Swinging Strike,91.0,2394.0,-13.6,-2.4,,,,,
pitch,824281,2026-05-05,2026,202605,Comerica Park,Boston Red Sox,Detroit Tigers,away,home,night,Caleb Durbin,702332,R,vs_LHP,Framber Valdez,664285,L,vs_RHB,Empty,Groundout,field_out,0,True,False,1,"Caleb Durbin grounds out, third baseman Zach McKinstry to first baseman Spencer Torkelson.",Sinker,"In play, out(s)",94.7,2259.0,-20.5,-15.7,89.3,-7.0,18.0,ground_ball,medium
pitch,824281,2026-05-05,2026,202605,Comerica Park,Boston Red Sox,Detroit Tigers,away,home,night,Connor Wong,657136,R,vs_LHP,Framber Valdez,664285,L,vs_RHB,Men_On,Hit By Pitch,hit_by_pitch,0,False,False,0,Connor Wong hit by pitch.,Curveball,Hit By Pitch,80.1,3088.0,-58.9,13.6,,,,,
pitch,824281,2026-05-05,2026,202605,Comerica Park,Boston Red Sox,Detroit Tigers,away,home,night,Isiah Kiner-Falefa,643396,R,vs_LHP,Framber Valdez,664285,L,vs_RHB,RISP,Groundout,field_out,0,True,False,1,"Isiah Kiner-Falefa grounds out, third baseman Zach McKinstry to first baseman Spencer Torkelson. Connor Wong to 2nd.",Sinker,"In play, out(s)",94.7,2337.0,-19.7,-15.1,77.4,-62.0,3.0,ground_ball,medium
pitch,824281,2026-05-05,2026,202605,Comerica Park,Boston Red Sox,Detroit Tigers,away,home,night,Jarren Duran,680776,L,vs_LHP,Framber Valdez,664285,L,vs_LHB,Empty,Strikeout,strikeout,0,True,False,1,"Dillon Dingler challenged (pitch result), call on the field was overturned: Jarren Duran called out on strikes.",Slider,Called Strike,84.3,2568.0,-39.6,4.7,,,,,
pitch,824281,2026-05-05,2026,202605,Comerica Park,Detroit Tigers,Boston Red Sox,home,away,night,Hao-Yu  Lee,701678,R,vs_RHP,Brayan Bello,678394,R,vs_RHB,Empty,Flyout,field_out,0,True,False,1,Hao-Yu Lee flies out to center fielder Ceddanne Rafaela.,Sinker,"In play, out(s)",93.7,2027.0,-23.4,13.3,76.4,29.0,261.0,fly_ball,medium
pitch,824281,2026-05-05,2026,202605,Comerica Park,Detroit Tigers,Boston Red Sox,home,away,night,Matt Vierling,663837,R,vs_RHP,Brayan Bello,678394,R,vs_RHB,Empty,Flyout,field_out,0,True,False,1,Matt Vierling flies out to right fielder Wilyer Abreu.,Sweeper,"In play, out(s)",84.7,2315.0,-43.7,-9.8,84.5,55.0,205.0,fly_ball,medium
pitch,824281,2026-05-05,2026,202605,Comerica Park,Detroit Tigers,Boston Red Sox,home,away,night,Kevin McGonigle,805808,L,vs_RHP,Brayan Bello,678394,R,vs_LHB,Empty,Flyout,field_out,0,True,False,1,Kevin McGonigle flies out to left fielder Jarren Duran.,Sinker,"In play, out(s)",94.2,2063.0,-21.4,13.3,95.6,61.0,212.0,fly_ball,medium
pitch,824281,2026-05-05,2026,202605,Comerica Park,Boston Red Sox,Detroit Tigers,away,home,night,Willson Contreras,575929,R,vs_LHP,Framber Valdez,664285,L,vs_RHB,Men_On,Walk,walk,0,False,False,0,Willson Contreras walks.,Sinker,Ball,94.9,2244.0,-18.1,-16.9,,,,,
pitch,824281,2026-05-05,2026,202605,Comerica Park,Boston Red Sox,Detroit Tigers,away,home,night,Wilyer Abreu,677800,L,vs_LHP,Framber Valdez,664285,L,vs_LHB,Men_On,Strikeout,strikeout,0,True,False,1,Wilyer Abreu strikes out swinging.,Slider,Swinging Strike,85.4,2561.0,-36.1,1.9,,,,,
pitch,824281,2026-05-05,2026,202605,Comerica Park,Boston Red Sox,Detroit Tigers,away,home,night,Trevor Story,596115,R,vs_LHP,Framber Valdez,664285,L,vs_RHB,RISP,Single,single,0,False,False,0,Trevor Story singles on a ground ball to right fielder Wenceel Pérez. Willson Contreras to 3rd.,Sinker,"In play, no out",95.8,2297.0,-22.4,-14.0,94.6,1.0,59.0,ground_ball,medium
pitch,824281,2026-05-05,2026,202605,Comerica Park,Boston Red Sox,Detroit Tigers,away,home,night,Ceddanne Rafaela,678882,R,vs_LHP,Framber Valdez,664285,L,vs_RHB,RISP,Single,single,1,False,True,0,Ceddanne Rafaela singles on a line drive to center fielder Matt Vierling. Willson Contreras scores. Trevor Story to 2nd.,Curveball,"In play, run(s)",78.6,2934.0,-61.1,8.6,99.5,11.0,212.0,line_drive,medium
pitch,824281,2026-05-05,2026,202605,Comerica Park,Boston Red Sox,Detroit Tigers,away,home,night,Andruw Monasterio,655316,R,vs_LHP,Framber Valdez,664285,L,vs_RHB,RISP,Single,single,1,False,True,0,Andruw Monasterio singles on a ground ball to center fielder Matt Vierling. Trevor Story scores. Ceddanne Rafaela to 2nd.,Changeup,"In play, run(s)",88.7,1670.0,-29.9,-14.8,99.3,7.0,118.0,ground_ball,medium
pitch,824281,2026-05-05,2026,202605,Comerica Park,Boston Red Sox,Detroit Tigers,away,home,night,Caleb Durbin,702332,R,vs_LHP,Framber Valdez,664285,L,vs_RHB,RISP,Single,single,1,False,True,0,Caleb Durbin singles on a ground ball to left fielder Riley Greene. Ceddanne Rafaela scores. Andruw Monasterio to 2nd.,Curveball,"In play, run(s)",77.2,2852.0,-63.2,13.7,97.1,7.0,118.0,ground_ball,medium
pitch,824281,2026-05-05,2026,202605,Comerica Park,Boston Red Sox,Detroit Tigers,away,home,night,Connor Wong,657136,R,vs_LHP,Framber Valdez,664285,L,vs_RHB,RISP,Single,single,1,False,True,0,"Tigers challenged (tag play), call on the field was upheld: Connor Wong singles on a line drive to center fielder Matt Vierling. Andruw Monasterio scores. Caleb Durbin to 3rd.",Changeup,"In play, run(s)",89.7,1639.0,-35.6,-13.7,80.6,26.0,294.0,line_drive,medium
pitch,824281,2026-05-05,2026,202605,Comerica Park,Boston Red Sox,Detroit Tigers,away,home,night,Isiah Kiner-Falefa,643396,R,vs_LHP,Framber Valdez,664285,L,vs_RHB,Men_On,Forceout,force_out,1,True,True,2,"Isiah Kiner-Falefa grounds into a force out, shortstop Kevin McGonigle to second baseman Hao-Yu Lee. Caleb Durbin scores. Connor Wong out at 2nd. Isiah Kiner-Falefa to 1st.",Sinker,"In play, run(s)",92.9,2266.0,-26.9,-16.1,95.8,-30.0,6.0,ground_ball,medium
pitch,824281,2026-05-05,2026,202605,Comerica Park,Boston Red Sox,Detroit Tigers,away,home,night,Jarren Duran,680776,L,vs_LHP,Framber Valdez,664285,L,vs_LHB,Empty,Strikeout,strikeout,0,True,False,1,Jarren Duran strikes out swinging.,Curveball,Swinging Strike (Blocked),79.2,3020.0,-58.2,12.0,,,,,
pitch,824281,2026-05-05,2026,202605,Comerica Park,Detroit Tigers,Boston Red Sox,home,away,night,Kerry Carpenter,681481,L,vs_RHP,Brayan Bello,678394,R,vs_LHB,Empty,Strikeout,strikeout,0,True,False,1,Kerry Carpenter strikes out swinging.,Four-Seam Fastball,Swinging Strike,94.3,1966.0,-18.2,4.6,,,,,
pitch,824281,2026-05-05,2026,202605,Comerica Park,Detroit Tigers,Boston Red Sox,home,away,night,Dillon Dingler,693307,R,vs_RHP,Brayan Bello,678394,R,vs_RHB,Empty,Flyout,field_out,0,True,False,1,Dillon Dingler flies out to center fielder Ceddanne Rafaela.,Cutter,"In play, out(s)",86.5,2244.0,-35.2,-0.7,90.0,42.0,298.0,fly_ball,medium
pitch,824281,2026-05-05,2026,202605,Comerica Park,Detroit Tigers,Boston Red Sox,home,away,night,Riley Greene,682985,L,vs_RHP,Brayan Bello,678394,R,vs_LHB,Men_On,Single,single,0,False,False,0,"Riley Greene singles on a ground ball to shortstop Trevor Story, deflected by second baseman Isiah Kiner-Falefa.",Four-Seam Fastball,"In play, no out",95.1,2120.0,-17.2,6.8,102.0,5.0,96.0,ground_ball,medium
pitch,824281,2026-05-05,2026,202605,Comerica Park,Detroit Tigers,Boston Red Sox,home,away,night,Wenceel Pérez,672761,L,vs_RHP,Brayan Bello,678394,R,vs_LHB,Empty,Strikeout,strikeout,0,True,False,1,Wenceel Pérez strikes out swinging.,Changeup,Swinging Strike,87.7,1662.0,-30.0,14.6,,,,,
pitch,824281,2026-05-05,2026,202605,Comerica Park,Boston Red Sox,Detroit Tigers,away,home,night,Willson Contreras,575929,R,vs_LHP,Framber Valdez,664285,L,vs_RHB,Empty,Home Run,home_run,1,False,True,0,Willson Contreras homers (8) on a fly ball to left center field.,Sinker,"In play, run(s)",92.0,2160.0,-24.5,-17.6,111.9,32.0,449.0,fly_ball,medium
pitch,824281,2026-05-05,2026,202605,Comerica Park,Boston Red Sox,Detroit Tigers,away,home,night,Wilyer Abreu,677800,L,vs_LHP,Framber Valdez,664285,L,vs_LHB,Empty,Home Run,home_run,1,False,True,0,Wilyer Abreu homers (5) on a fly ball to right field.,Curveball,"In play, run(s)",76.5,2743.0,-61.4,9.2,109.1,23.0,396.0,fly_ball,medium
pitch,824281,2026-05-05,2026,202605,Comerica Park,Boston Red Sox,Detroit Tigers,away,home,night,Trevor Story,596115,R,vs_LHP,Framber Valdez,664285,L,vs_RHB,Men_On,Hit By Pitch,hit_by_pitch,0,False,False,0,Trevor Story hit by pitch.,Four-Seam Fastball,Hit By Pitch,94.4,2212.0,-16.3,-6.0,,,,,
pitch,824281,2026-05-05,2026,202605,Comerica Park,Boston Red Sox,Detroit Tigers,away,home,night,Ceddanne Rafaela,678882,R,vs_RHP,Brenan Hanifee,669724,R,vs_RHB,Empty,Grounded Into DP,grounded_into_double_play,0,True,False,2,"Ceddanne Rafaela grounds into a double play, second baseman Hao-Yu Lee to shortstop Kevin McGonigle to first baseman Spencer Torkelson. Trevor Story out at 2nd. Ceddanne Rafaela out at 1st.",Sinker,"In play, out(s)",94.0,2103.0,-25.8,17.6,82.7,-4.0,28.0,ground_ball,medium
pitch,824281,2026-05-05,2026,202605,Comerica Park,Boston Red Sox,Detroit Tigers,away,home,night,Andruw Monasterio,655316,R,vs_RHP,Brenan Hanifee,669724,R,vs_RHB,Empty,Strikeout,strikeout,0,True,False,1,Andruw Monasterio called out on strikes.,Slider,Called Strike,87.7,2283.0,-31.7,-2.2,,,,,
pitch,824281,2026-05-05,2026,202605,Comerica Park,Detroit Tigers,Boston Red Sox,home,away,night,Spencer Torkelson,679529,R,vs_RHP,Brayan Bello,678394,R,vs_RHB,Empty,Strikeout,strikeout,0,True,False,1,Spencer Torkelson strikes out swinging.,Sweeper,Swinging Strike,86.0,2239.0,-43.8,-5.9,,,,,
pitch,824281,2026-05-05,2026,202605,Comerica Park,Detroit Tigers,Boston Red Sox,home,away,night,Zach McKinstry,656716,L,vs_RHP,Brayan Bello,678394,R,vs_LHB,Empty,Flyout,field_out,0,True,False,1,Zach McKinstry flies out to left fielder Jarren Duran.,Sinker,"In play, out(s)",94.1,2002.0,-22.3,15.7,93.5,43.0,311.0,fly_ball,medium
pitch,824281,2026-05-05,2026,202605,Comerica Park,Detroit Tigers,Boston Red Sox,home,away,night,Hao-Yu  Lee,701678,R,vs_RHP,Brayan Bello,678394,R,vs_RHB,Empty,Strikeout,strikeout,0,True,False,1,Hao-Yu Lee strikes out swinging.,Sweeper,Swinging Strike,84.3,2226.0,-40.7,-8.5,,,,,
pitch,824281,2026-05-05,2026,202605,Comerica Park,Boston Red Sox,Detroit Tigers,away,home,night,Caleb Durbin,702332,R,vs_RHP,Brenan Hanifee,669724,R,vs_RHB,Men_On,Single,single,0,False,False,0,Caleb Durbin singles on a line drive to center fielder Matt Vierling.,Sinker,"In play, no out",93.7,2075.0,-27.4,16.1,85.4,19.0,277.0,line_drive,medium
pitch,824281,2026-05-05,2026,202605,Comerica Park,Boston Red Sox,Detroit Tigers,away,home,night,Connor Wong,657136,R,vs_RHP,Brenan Hanifee,669724,R,vs_RHB,Men_On,Strikeout,strikeout,0,True,False,1,Connor Wong called out on strikes.,Sinker,Called Strike,95.8,2180.0,-24.7,17.3,,,,,
pitch,824281,2026-05-05,2026,202605,Comerica Park,Boston Red Sox,Detroit Tigers,away,home,night,Isiah Kiner-Falefa,643396,R,vs_RHP,Brenan Hanifee,669724,R,vs_RHB,RISP,Groundout,field_out,0,True,False,1,"Isiah Kiner-Falefa grounds out, third baseman Zach McKinstry to first baseman Spencer Torkelson. Caleb Durbin to 2nd.",Sinker,"In play, out(s)",95.9,2260.0,-22.7,15.6,65.8,-70.0,3.0,ground_ball,medium
pitch,824281,2026-05-05,2026,202605,Comerica Park,Boston Red Sox,Detroit Tigers,away,home,night,Jarren Duran,680776,L,vs_RHP,Brenan Hanifee,669724,R,vs_LHB,Empty,Flyout,field_out,0,True,False,1,Jarren Duran flies out to third baseman Zach McKinstry in foul territory.,Changeup,"In play, out(s)",90.2,1756.0,-33.2,15.6,74.6,58.0,186.0,fly_ball,medium
pitch,824281,2026-05-05,2026,202605,Comerica Park,Detroit Tigers,Boston Red Sox,home,away,night,Matt Vierling,663837,R,vs_RHP,Brayan Bello,678394,R,vs_RHB,Men_On,Single,single,0,False,False,0,Matt Vierling singles on a ground ball to center fielder Ceddanne Rafaela.,Four-Seam Fastball,"In play, no out",92.8,2074.0,-20.5,6.0,103.5,4.0,92.0,ground_ball,medium
pitch,824281,2026-05-05,2026,202605,Comerica Park,Detroit Tigers,Boston Red Sox,home,away,night,Kevin McGonigle,805808,L,vs_RHP,Brayan Bello,678394,R,vs_LHB,Men_On,Forceout,force_out,0,True,False,2,"Kevin McGonigle grounds into a force out, second baseman Isiah Kiner-Falefa to shortstop Trevor Story. Matt Vierling out at 2nd. Kevin McGonigle to 1st.",Sinker,"In play, out(s)",94.2,2052.0,-23.2,14.3,96.6,-8.0,16.0,ground_ball,medium
pitch,824281,2026-05-05,2026,202605,Comerica Park,Detroit Tigers,Boston Red Sox,home,away,night,Kerry Carpenter,681481,L,vs_RHP,Brayan Bello,678394,R,vs_LHB,RISP,Single,single,0,False,False,0,Kerry Carpenter singles on a sharp line drive to left fielder Jarren Duran. Kevin McGonigle to 2nd.,Four-Seam Fastball,"In play, no out",94.5,2056.0,-18.2,5.8,102.4,11.0,223.0,line_drive,hard
pitch,824281,2026-05-05,2026,202605,Comerica Park,Detroit Tigers,Boston Red Sox,home,away,night,Dillon Dingler,693307,R,vs_RHP,Brayan Bello,678394,R,vs_RHB,RISP,Single,single,1,False,True,0,Dillon Dingler singles on a sharp line drive to left fielder Jarren Duran. Kevin McGonigle scores. Kerry Carpenter to 2nd.,Sinker,"In play, run(s)",94.4,2034.0,-18.8,13.1,103.0,11.0,181.0,line_drive,hard
pitch,824281,2026-05-05,2026,202605,Comerica Park,Detroit Tigers,Boston Red Sox,home,away,night,Riley Greene,682985,L,vs_RHP,Brayan Bello,678394,R,vs_LHB,RISP,Flyout,field_out,0,True,False,1,Riley Greene flies out to center fielder Ceddanne Rafaela.,Changeup,"In play, out(s)",88.1,1841.0,-28.4,14.8,100.0,42.0,360.0,fly_ball,medium
pitch,824281,2026-05-05,2026,202605,Comerica Park,Detroit Tigers,Boston Red Sox,home,away,night,Wenceel Pérez,672761,L,vs_RHP,Brayan Bello,678394,R,vs_LHB,Empty,Groundout,field_out,0,True,False,1,Wenceel Pérez grounds out to first baseman Willson Contreras.,Sinker,"In play, out(s)",94.4,1958.0,-20.6,11.3,88.2,-33.0,5.0,ground_ball,medium
pitch,824281,2026-05-05,2026,202605,Comerica Park,Boston Red Sox,Detroit Tigers,away,home,night,Willson Contreras,575929,R,vs_RHP,Brenan Hanifee,669724,R,vs_RHB,Empty,Groundout,field_out,0,True,False,1,"Willson Contreras grounds out, shortstop Kevin McGonigle to first baseman Spencer Torkelson.",Sinker,"In play, out(s)",94.4,2164.0,-26.5,17.4,80.5,-40.0,3.0,ground_ball,medium
pitch,824281,2026-05-05,2026,202605,Comerica Park,Boston Red Sox,Detroit Tigers,away,home,night,Wilyer Abreu,677800,L,vs_RHP,Brenan Hanifee,669724,R,vs_LHB,Men_On,Walk,walk,0,False,False,0,Wilyer Abreu walks.,Sinker,Ball,95.0,2081.0,-27.4,18.6,,,,,
pitch,824281,2026-05-05,2026,202605,Comerica Park,Boston Red Sox,Detroit Tigers,away,home,night,Trevor Story,596115,R,vs_RHP,Brenan Hanifee,669724,R,vs_RHB,Men_On,Forceout,force_out,0,True,False,2,"Trevor Story grounds into a force out, shortstop Kevin McGonigle to second baseman Hao-Yu Lee. Wilyer Abreu out at 2nd. Trevor Story to 1st.",Sinker,"In play, out(s)",95.0,2044.0,-28.1,17.6,100.3,-32.0,5.0,ground_ball,medium
pitch,824281,2026-05-05,2026,202605,Comerica Park,Boston Red Sox,Detroit Tigers,away,home,night,Ceddanne Rafaela,678882,R,vs_RHP,Brenan Hanifee,669724,R,vs_RHB,RISP,Single,single,0,False,False,0,Ceddanne Rafaela singles on a line drive to center fielder Matt Vierling. Trevor Story to 2nd.,Sinker,"In play, no out",94.8,2211.0,-26.2,16.2,87.1,10.0,158.0,line_drive,medium
pitch,824281,2026-05-05,2026,202605,Comerica Park,Boston Red Sox,Detroit Tigers,away,home,night,Andruw Monasterio,655316,R,vs_RHP,Brenan Hanifee,669724,R,vs_RHB,Empty,Forceout,force_out,0,True,False,2,"Andruw Monasterio grounds into a force out, fielded by second baseman Hao-Yu Lee. Ceddanne Rafaela out at 2nd.",Sinker,"In play, out(s)",95.9,1934.0,-25.3,13.4,100.7,-8.0,11.0,ground_ball,medium
pitch,824281,2026-05-05,2026,202605,Comerica Park,Detroit Tigers,Boston Red Sox,home,away,night,Spencer Torkelson,679529,R,vs_RHP,Brayan Bello,678394,R,vs_RHB,Empty,Strikeout,strikeout,0,True,False,1,Spencer Torkelson strikes out swinging.,Sinker,Swinging Strike,94.5,2044.0,-25.6,15.1,,,,,
pitch,824281,2026-05-05,2026,202605,Comerica Park,Detroit Tigers,Boston Red Sox,home,away,night,Zach McKinstry,656716,L,vs_RHP,Brayan Bello,678394,R,vs_LHB,Empty,Groundout,field_out,0,True,False,1,"Zach McKinstry grounds out, first baseman Willson Contreras to pitcher Brayan Bello.",Curveball,"In play, out(s)",82.7,2460.0,-50.3,-0.6,78.4,-3.0,19.0,ground_ball,medium
pitch,824281,2026-05-05,2026,202605,Comerica Park,Detroit Tigers,Boston Red Sox,home,away,night,Hao-Yu  Lee,701678,R,vs_RHP,Brayan Bello,678394,R,vs_RHB,Empty,Groundout,field_out,0,True,False,1,"Hao-Yu Lee grounds out, shortstop Trevor Story to first baseman Willson Contreras.",Sweeper,"In play, out(s)",85.4,2274.0,-41.9,-9.0,89.1,5.0,91.0,ground_ball,medium
pitch,824281,2026-05-05,2026,202605,Comerica Park,Boston Red Sox,Detroit Tigers,away,home,night,Caleb Durbin,702332,R,vs_RHP,Burch Smith,572143,R,vs_RHB,Empty,Strikeout,strikeout,0,True,False,1,Caleb Durbin called out on strikes.,Four-Seam Fastball,Called Strike,94.9,2415.0,-13.8,3.0,,,,,
pitch,824281,2026-05-05,2026,202605,Comerica Park,Boston Red Sox,Detroit Tigers,away,home,night,Connor Wong,657136,R,vs_RHP,Burch Smith,572143,R,vs_RHB,Empty,Groundout,field_out,0,True,False,1,"Connor Wong grounds out, second baseman Hao-Yu Lee to first baseman Spencer Torkelson.",Cutter,"In play, out(s)",90.8,2432.0,-30.7,-3.2,85.1,-32.0,5.0,ground_ball,medium
pitch,824281,2026-05-05,2026,202605,Comerica Park,Boston Red Sox,Detroit Tigers,away,home,night,Isiah Kiner-Falefa,643396,R,vs_RHP,Burch Smith,572143,R,vs_RHB,Empty,Groundout,field_out,0,True,False,1,"Isiah Kiner-Falefa grounds out softly, catcher Dillon Dingler to first baseman Spencer Torkelson.",Cutter,"In play, out(s)",89.1,2421.0,-32.2,-2.9,59.9,-80.0,3.0,ground_ball,soft
pitch,824281,2026-05-05,2026,202605,Comerica Park,Detroit Tigers,Boston Red Sox,home,away,night,Matt Vierling,663837,R,vs_RHP,Brayan Bello,678394,R,vs_RHB,Empty,Groundout,field_out,0,True,False,1,"Matt Vierling grounds out, shortstop Trevor Story to first baseman Willson Contreras.",Sinker,"In play, out(s)",93.5,2040.0,-21.7,12.5,98.2,0.0,52.0,ground_ball,medium
pitch,824281,2026-05-05,2026,202605,Comerica Park,Detroit Tigers,Boston Red Sox,home,away,night,Kevin McGonigle,805808,L,vs_RHP,Brayan Bello,678394,R,vs_LHB,Men_On,Walk,walk,0,False,False,0,Kevin McGonigle walks.,Cutter,Ball,86.9,2325.0,-34.9,-2.0,,,,,
pitch,824281,2026-05-05,2026,202605,Comerica Park,Detroit Tigers,Boston Red Sox,home,away,night,Kerry Carpenter,681481,L,vs_RHP,Brayan Bello,678394,R,vs_LHB,Empty,Double Play,double_play,0,True,False,2,"Kerry Carpenter lines into a double play, second baseman Isiah Kiner-Falefa to shortstop Trevor Story. Kevin McGonigle out at 2nd.",Sinker,"In play, out(s)",95.5,2063.0,-22.9,15.6,95.2,12.0,164.0,line_drive,medium
pitch,824281,2026-05-05,2026,202605,Comerica Park,Boston Red Sox,Detroit Tigers,away,home,night,Jarren Duran,680776,L,vs_RHP,Burch Smith,572143,R,vs_LHB,Empty,Strikeout,strikeout,0,True,False,1,Jarren Duran strikes out swinging.,Four-Seam Fastball,Swinging Strike,95.8,2251.0,-12.2,0.6,,,,,
pitch,824281,2026-05-05,2026,202605,Comerica Park,Boston Red Sox,Detroit Tigers,away,home,night,Willson Contreras,575929,R,vs_RHP,Burch Smith,572143,R,vs_RHB,Empty,Strikeout,strikeout,0,True,False,1,Willson Contreras called out on strikes.,Four-Seam Fastball,Called Strike,96.1,2467.0,-11.8,4.3,,,,,
pitch,824281,2026-05-05,2026,202605,Comerica Park,Boston Red Sox,Detroit Tigers,away,home,night,Wilyer Abreu,677800,L,vs_RHP,Burch Smith,572143,R,vs_LHB,Men_On,Single,single,0,False,False,0,Wilyer Abreu singles on a ground ball to right fielder Wenceel Pérez.,Cutter,"In play, no out",90.6,2441.0,-23.8,-2.4,105.7,-7.0,12.0,ground_ball,medium
pitch,824281,2026-05-05,2026,202605,Comerica Park,Boston Red Sox,Detroit Tigers,away,home,night,Trevor Story,596115,R,vs_RHP,Burch Smith,572143,R,vs_RHB,Empty,Strikeout,strikeout,0,True,False,1,"Trevor Story strikes out swinging, catcher Dillon Dingler to first baseman Spencer Torkelson.",Curveball,Swinging Strike (Blocked),84.5,2440.0,-52.7,-8.2,,,,,
pitch,824281,2026-05-05,2026,202605,Comerica Park,Detroit Tigers,Boston Red Sox,home,away,night,Dillon Dingler,693307,R,vs_RHP,Brayan Bello,678394,R,vs_RHB,Empty,Strikeout,strikeout,0,True,False,1,Dillon Dingler called out on strikes.,Sinker,Called Strike,95.2,1975.0,-21.5,14.5,,,,,
pitch,824281,2026-05-05,2026,202605,Comerica Park,Detroit Tigers,Boston Red Sox,home,away,night,Riley Greene,682985,L,vs_RHP,Brayan Bello,678394,R,vs_LHB,Empty,Strikeout,strikeout,0,True,False,1,Riley Greene called out on strikes.,Sinker,Called Strike,94.0,1957.0,-23.8,16.1,,,,,
pitch,824281,2026-05-05,2026,202605,Comerica Park,Detroit Tigers,Boston Red Sox,home,away,night,Wenceel Pérez,672761,L,vs_RHP,Brayan Bello,678394,R,vs_LHB,Empty,Lineout,field_out,0,True,False,1,Wenceel Pérez lines out sharply to center fielder Ceddanne Rafaela.,Sinker,"In play, out(s)",94.0,1947.0,-21.7,15.0,105.3,19.0,356.0,line_drive,hard
pitch,824281,2026-05-05,2026,202605,Comerica Park,Boston Red Sox,Detroit Tigers,away,home,night,Ceddanne Rafaela,678882,R,vs_LHP,Enmanuel De Jesus,646241,L,vs_RHB,Empty,Strikeout,strikeout,0,True,False,1,Ceddanne Rafaela strikes out swinging.,Changeup,Swinging Strike,87.1,2208.0,-30.1,-19.4,,,,,
